Latitude,Longitude,ID,Date
43.635063,3.831138,4519266685,2/2/2024 12:22:54 PM
43.98136,4.763891,4522612830,2/7/2024 1:42:49 PM
43.604624,1.444209,4067264156,2023-03-11
43.470272,3.232081,4129831104,2023-05-12T16:44
44.06004,4.82735,4542259320,2023-05-29
44.4064,5.27212,4545850330,2023-06-24
44.83394,4.79709,4541794704,2023-06-27
44.82997,4.80513,4541669693,2023-06-27
44.82997,4.80513,4541795108,2023-06-27
44.82821,4.80141,4541679311,2023-06-27
44.82821,4.80141,4541742008,2023-06-27
45.65328,4.8381,4541782636,2023-06-27
45.647,4.83255,4541741580,2023-06-27
44.84978,4.85035,4541689976,2023-06-27
45.64254,4.82821,4541669835,2023-06-27
44.85204,4.8484,4541858051,2023-06-27
44.85596,4.83243,4541782814,2023-06-27
44.8336,4.81192,4541733949,2023-06-27
44.83394,4.79709,4541857342,2023-06-27
44.83244,4.79759,4541786588,2023-06-27
44.82821,4.80141,4541776407,2023-06-27
44.82997,4.80513,4541782324,2023-06-27
44.82556,4.80777,4541679331,2023-06-27
44.82556,4.80777,4541719083,2023-06-27
44.82447,4.80694,4541741817,2023-06-27
44.3972,4.1717,4541741454,2023-06-24
44.3972,4.1717,4541733402,2023-06-24
44.86141,4.95127,4541777281,2023-06-25
44.86141,4.95127,4541819245,2023-06-25
44.85739,4.94969,4541749987,2023-06-25
44.86836,4.92048,4541782808,2023-06-24
44.40377,4.17871,4541689863,2023-06-24
44.40377,4.17871,4541776584,2023-06-24
44.40377,4.17871,4541864438,2023-06-24
44.40377,4.17871,4541800388,2023-06-24
44.3972,4.1717,4541742011,2023-06-24
44.40196,4.17394,4541759112,2023-06-24
44.40196,4.17394,4541795082,2023-06-24
44.40196,4.17394,4541669437,2023-06-24
44.40196,4.17394,4541783121,2023-06-24
44.3972,4.1717,4541819034,2023-06-24
44.3972,4.1717,4541733896,2023-06-24
44.3972,4.1717,4541670091,2023-06-24
44.40236,4.18892,4541689794,2023-06-24
44.40236,4.18892,4541689587,2023-06-24
44.40377,4.17871,4541718850,2023-06-24
44.40377,4.17871,4541846102,2023-06-24
44.40377,4.17871,4541782510,2023-06-24
44.40196,4.17394,4541707076,2023-06-24
44.40196,4.17394,4541782914,2023-06-24
44.40377,4.17871,4541783070,2023-06-24
44.40377,4.17871,4541800785,2023-06-24
44.40395,4.18479,4541741906,2023-06-24
44.39993,4.18458,4541829583,2023-06-24
44.39534,4.17732,4541768185,2023-06-24
44.39534,4.17732,4541786697,2023-06-24
44.39612,4.19678,4541783004,2023-06-24
44.39612,4.19678,4541845395,2023-06-24
44.51349,4.31866,4541679451,2023-06-24
44.73734,4.6413,4541718598,2023-06-24
44.85204,4.84888,4541846042,2023-06-24
44.78775,4.77176,4541830244,2023-06-24
44.76101,4.73121,4541795085,2023-06-24
44.76058,4.71696,4541706845,2023-06-24
44.73631,4.61611,4541734106,2023-06-24
44.72721,4.55402,4541770505,2023-06-24
44.90082,4.93501,4541690158,2023-06-23
43.649963,3.846887,4137997042,6/17/2023 2:52:35 PM
43.365705,5.013549,4138044907,6/19/2023 11:15:57 AM
45.098797,1.225657,4424108563,2023-06-20T18:20
43.371059,6.292902,4138567843,6/22/2023 11:11:40 AM
43.700402,4.137386,4138642081,6/22/2023 5:15:02 PM
44.647357,-1.158552,4138700407,2023-06-18T12:42
44.647906,-1.160231,4138527639,2023-06-18T12:56
44.643131,-1.118947,4138622073,2023-06-18T13:58
43.729948,4.167821,4138203459,6/24/2023 4:43:59 PM
43.632422,3.857212,4424460442,6/25/2023 4:02:23 PM
43.079689,6.125736,4599709039,6/26/2023 1:41:47 PM
45.69952,-1.230981,4424424431,6/26/2023 4:51:32 PM
43.178099,2.540983,4138646985,2023-06-27T12:17
43.694886,4.125781,4138652273,6/27/2023 10:42:13 AM
43.694565,3.674374,4138604147,6/27/2023 8:36:31 PM
43.6326,3.907247,4145442096,6/28/2023 10:19:36 AM
43.492,3.677613,4145284074,2023-06-28T09:20
44.362162,1.63538,4145384070,6/27/2023 1:11:26 PM
43.639002,3.86482,4145594615,6/29/2023 1:18:37 PM
45.784102,4.892125,4145425352,6/29/2023 6:44:26 PM
43.607953,3.512207,4145670748,2023-06-29T18:34
43.814011,3.61797,4145676360,6/26/2023 2:56:15 PM
42.233999,8.563943,4153713791,6/29/2023 10:15:53 AM
44.441823,5.28692,4172107351,2023-06-24T14:36
44.409866,5.256964,4171782034,2023-06-24T15:48
43.09063,5.84972,4159494213,2023-06-13
43.091579,5.847979,4160775200,2023-06-13
44.058208,4.794915,4408598311,2023-06-16
43.450155,2.978346,4408478877,2023-06-25
43.449878,2.980223,4408660842,2023-06-26
44.938937,0.997787,4408119030,2023-06-27
45.110907,1.228023,4461191094,2023-06-28
44.89966,4.934192,4461952704,2023-06-23
44.853231,4.844618,4462008530,2023-06-24
44.51206,4.317006,4459792487,2023-06-24
44.40449,4.17658,4461328457,2023-06-24
44.404065,4.17506,4462302645,2023-06-24
44.404065,4.17506,4459838669,2023-06-24
44.865576,4.919718,4460755350,2023-06-24
44.856295,4.94947,4460696129,2023-06-25
44.824616,4.803466,4459880484,2023-06-27
44.824008,4.81052,4460434836,2023-06-27
44.824008,4.81052,4459848715,2023-06-27
44.830572,4.806764,4459648794,2023-06-27
44.826291,4.80257,4462008531,2023-06-27
44.832174,4.795453,4459872609,2023-06-27
44.834247,4.795291,4462270791,2023-06-27
44.832661,4.809891,4459629778,2023-06-27
44.856759,4.834743,4461247908,2023-06-27
44.853231,4.844618,4461246372,2023-06-27
44.847517,4.849026,4459777741,2023-06-27
44.826291,4.80257,4462043508,2023-06-27
44.826291,4.80257,4461650869,2023-06-27
44.830572,4.806764,4461340483,2023-06-27
44.830572,4.806764,4459718256,2023-06-27
44.834247,4.795291,4459666665,2023-06-27
44.396259,4.195255,4459523865,2023-06-24
44.396259,4.195255,4460772125,2023-06-24
44.394604,4.179182,4459671737,2023-06-24
44.394604,4.179182,4459874806,2023-06-24
44.398559,4.186925,4459805253,2023-06-24
44.402001,4.190802,4460684708,2023-06-24
44.4068,4.188952,4461828243,2023-06-24
44.40449,4.17658,4459657077,2023-06-24
44.404065,4.17506,4460950605,2023-06-24
44.404065,4.17506,4459848717,2023-06-24
44.404065,4.17506,4461340485,2023-06-24
44.404065,4.17506,4459666666,2023-06-24
44.40449,4.17658,4459867332,2023-06-24
44.40449,4.17658,4459799639,2023-06-24
44.40449,4.17658,4461439008,2023-06-24
44.402001,4.190802,4461976473,2023-06-24
44.39551,4.170265,4459838672,2023-06-24
44.39551,4.170265,4461504011,2023-06-24
44.39551,4.170265,4459874807,2023-06-24
44.39551,4.170265,4459687140,2023-06-24
44.40449,4.17658,4459870942,2023-06-24
44.40449,4.17658,4459629779,2023-06-24
44.40449,4.17658,4461246373,2023-06-24
44.40449,4.17658,4459539067,2023-06-24
44.859474,4.951057,4461976474,2023-06-25
44.859474,4.951057,4460409775,2023-06-25
44.39551,4.170265,4461440619,2023-06-24
44.39551,4.170265,4460485989,2023-06-24
44.85749,1.32534,4552714473,2023-06-24
44.86945,-0.68437,4555104262,2023-06-28
44.85749,1.32534,4552714340,2023-06-28
42.68783,2.75016,4544331064,2023-06-11
43.04775,2.8835,4544361554,2023-06-13
44.44388,4.30061,4544330923,2023-06-23
43.76171,5.20072,4542259994,2023-06-11
43.78865,5.12426,4542259865,2023-06-11
43.7632,5.30299,4542259688,2023-06-15
43.9131,5.05631,4542259335,2023-06-24
43.70742,5.43083,4542259336,2023-06-28
43.77827,5.44316,4542259353,2023-06-28
44.22228,5.13357,4542259439,2023-06-29
44.17482,5.37208,4542259689,2023-06-29
42.84019,2.59066,4544389665,2023-07-18
42.84024,2.60288,4544389858,2023-07-18
44.01503,4.86678,4542259318,2023-07-07
44.28514,5.13677,4542259964,2023-07-08
44.28514,5.13677,4542259833,2023-07-08
44.03128,5.50365,4542259618,2023-07-09
44.08679,4.88208,4542259696,2023-07-11
44.12898,4.81028,4542259831,2023-07-14
44.01291,5.25317,4542259303,2023-07-16
42.69705,2.8842,4544389451,2023-07-24
44.14291,0.25339,4586347358,2023-07-20
44.07311,5.39905,4542259518,2023-07-23
43.95908,5.37322,4542259777,2023-07-23
44.19398,4.84762,4542259817,2023-07-24
43.68756,5.52013,4542259433,2023-07-27
43.68756,5.52013,4542259310,2023-07-27
45.31546,4.79408,4541734103,2023-07-26
44.85754,4.94951,4541706806,2023-07-23
44.85751,4.94793,4541801122,2023-07-23
44.85992,4.95165,4541865188,2023-07-23
44.85825,4.94962,4541783244,2023-07-22
44.7324,4.98419,4541776690,2023-07-22
44.7324,4.98419,4541864579,2023-07-22
44.7324,4.98419,4541794403,2023-07-22
44.73208,4.98692,4541741921,2023-07-22
44.76861,4.84736,4541741672,2023-07-22
44.76861,4.84736,4541718644,2023-07-22
44.76861,4.84736,4541718450,2023-07-22
44.76849,4.84309,4541818911,2023-07-22
44.76849,4.84309,4541680223,2023-07-22
44.76849,4.84309,4541782756,2023-07-22
44.85791,4.95003,4541758685,2023-07-22
44.85769,4.94844,4541749933,2023-07-22
44.92013,4.84988,4541794421,2023-07-21
44.92013,4.84988,4541679951,2023-07-21
44.925,4.86691,4541733569,2023-07-21
44.93039,4.88597,4541758530,2023-07-21
44.92985,4.87542,4541777282,2023-07-21
44.92013,4.84988,4541669652,2023-07-21
44.92013,4.84988,4541767580,2023-07-21
44.92013,4.84988,4541767841,2023-07-21
44.92013,4.84988,4541776387,2023-07-21
44.92013,4.84988,4541864401,2023-07-21
44.92469,4.85447,4541829947,2023-07-21
44.9276,4.85585,4541865010,2023-07-21
44.92808,4.88674,4541758876,2023-07-21
44.93039,4.88597,4541758569,2023-07-21
44.8592,4.94972,4541759130,2023-07-21
44.85337,4.9637,4541795087,2023-07-21
44.84625,4.97263,4541741319,2023-07-21
44.84345,4.97602,4541718343,2023-07-21
44.83697,4.97981,4541818936,2023-07-21
44.85699,4.94902,4541845381,2023-07-21
44.84623,4.96121,4541776331,2023-07-21
44.8402,4.96375,4541857301,2023-07-21
44.8364,4.96915,4541829510,2023-07-21
44.90878,4.88372,4541864864,2023-07-21
44.93082,4.88871,4541857691,2023-07-21
44.86101,4.95531,4541782851,2023-07-21
44.858,4.94953,4541749570,2023-07-20
44.858,4.94953,4541669564,2023-07-20
44.85782,4.94783,4541706385,2023-07-20
45.51595,4.85796,4541857896,2023-07-20
44.90363,4.92667,4541857399,2023-07-20
44.9727,4.88631,4541782803,2023-07-20
45.64891,4.83463,4541680283,2023-07-20
45.68853,4.84561,4541718727,2023-07-20
45.6998,4.83519,4541741555,2023-07-20
45.73231,4.81682,4541749704,2023-07-20
45.7521,4.8206,4541767398,2023-07-20
45.78388,4.8917,4541742288,2023-07-20
45.77957,4.89514,4541670275,2023-07-20
44.85699,4.94902,4541786625,2023-07-21
45.7588,4.92525,4541707002,2023-07-19
45.6917,4.84604,4541749824,2023-07-15
45.70226,4.84476,4541758661,2023-07-15
45.71566,4.84446,4541770839,2023-07-15
45.68428,4.8472,4541758309,2023-07-15
45.68549,4.86007,4541782655,2023-07-15
45.68549,4.86007,4541733770,2023-07-15
45.72729,4.93588,4541706760,2023-07-08
45.81222,4.84222,4541758780,2023-07-02
43.720372,4.148537,4145611014,2023-07-01T17:28
44.411939,4.850396,4145266762,7/2/2023 10:48:09 AM
43.233042,5.368051,4145504857,2023-07-02T12:18
44.315137,0.897396,4442363793,7/2/2023 6:14:38 PM
43.628901,3.843043,4145506689,7/2/2023 4:30:32 PM
42.635992,2.749798,4145837460,7/4/2023 7:01:35 AM
43.492351,3.678244,4145404650,2023-07-04T10:30
43.227936,5.354481,4145402073,2023-07-03T12:15
43.227936,5.354481,4145788368,2023-07-03T14:47
43.775587,3.954232,4161972715,2023-07-04T23:04
45.098875,1.225888,4153721920,7/5/2023 11:56:59 AM
43.583059,-1.40967,4153751084,2023-07-04T12:27
43.703282,4.142206,4153883137,7/5/2023 11:26:31 AM
44.05085,5.032938,4153376584,7/1/2023 10:24:49 AM
43.46685,6.723311,4600034073,7/5/2023 4:43:43 PM
43.456168,3.634756,4153563330,2023-07-06T11:50
43.492017,3.678226,4153449517,2023-07-07T10:02
43.088561,2.978861,4153418621,7/1/2023 4:22:49 PM
43.65207,3.861731,4153710951,2023-07-05T14:24
43.608733,4.012129,4442529762,7/8/2023 10:58:25 AM
43.587623,6.958674,4153502906,7/8/2023 5:50:32 PM
44.696095,-0.452256,4162026774,2023-07-08T12:56
41.693397,8.918942,4153921071,7/9/2023 10:09:01 AM
44.570229,1.788936,4153420580,7/9/2023 10:46:41 AM
44.017128,4.052868,4153936659,7/9/2023 12:35:49 PM
43.829568,3.627643,4153402175,2023-07-08T16:14
43.469958,3.641889,4442468754,7/9/2023 6:01:07 PM
43.695021,5.386753,4153994154,2023-07-09
43.230748,2.637983,4442454808,2023-07-08T03:11
43.33387,5.151733,4153777460,7/9/2023 2:17:06 PM
43.765652,4.422082,4153869876,7/10/2023 12:38:43 PM
44.809104,-0.598596,4153751954,2023-07-10T14:19
44.470391,1.686652,4442579742,7/11/2023 12:13:12 PM
43.172129,6.119403,4153447277,7/8/2023 7:49:50 PM
43.717781,5.232703,4442371793,7/7/2023 11:11:53 AM
42.65163,9.074906,4153748793,7/11/2023 1:19:14 PM
45.781651,4.873662,4153596623,7/11/2023 8:56:28 AM
42.503557,9.464954,4153755913,7/11/2023 11:05:32 PM
43.727059,4.032261,4162034993,7/12/2023 8:50:53 AM
43.665351,3.914532,4162050079,2023-07-09T08:25
41.587402,9.32976,4442616757,7/12/2023 11:26:04 AM
43.01161,6.384948,4162048968,7/12/2023 11:36:10 AM
43.670067,7.026405,4442402786,7/12/2023 3:37:44 PM
43.472889,3.625113,4162135127,7/12/2023 4:42:39 PM
43.702886,3.862506,4162156022,7/11/2023 6:40:37 PM
43.088284,2.687431,4442617795,2023-07-03T23:21
43.233688,5.436879,4162358528,7/13/2023 5:36:12 PM
43.625892,6.646738,4162079604,7/11/2023 3:42:24 PM
43.744479,4.862299,4162383543,7/13/2023 5:54:25 PM
43.686874,5.514551,4162356767,7/14/2023 3:17:25 PM
43.752569,4.796894,4162131077,7/14/2023 12:42:51 PM
43.614204,4.013696,4442385757,7/14/2023 4:53:26 PM
43.818017,6.097825,4416729388,7/14/2023 6:27:27 PM
44.069848,3.840484,4162271945,2023-07-14T18:50
43.493643,3.653738,4162066291,2023-07-14T18:01
43.644899,5.268879,4442363822,2023-07-10T13:05
43.610769,3.876716,4162521836,2023-07-13T18:16
43.446936,3.995954,4162304088,7/15/2023 12:52:42 PM
43.523887,5.589558,4162079748,7/2/2023 2:21:14 PM
43.274705,5.480363,4162014289,2023-07-15T15:20
43.750705,4.069749,4162121261,2023-07-15T16:22
44.375447,1.517395,4420794544,7/3/2023 12:37:06 PM
43.274659,5.380113,4162147728,2023-07-15T17:56
43.275182,5.380106,4162326257,2023-07-15T19:03
44.633495,-1.125372,4162497304,2023-07-16T11:34
43.907291,3.743992,4162139042,7/16/2023 3:17:03 PM
44.122534,3.934545,4442548806,7/15/2023 10:34:27 PM
43.941998,4.860224,4524897164,7/16/2023 5:14:54 PM
43.812003,4.367476,4162258217,7/11/2023 2:02:51 PM
43.860338,7.298586,4162539506,7/16/2023 2:04:08 PM
43.012318,6.386549,4161976868,2023-07-12T15:24
44.313785,1.150901,4413900574,2023-07-11T12:10
43.665853,3.671279,4162553442,2023-07-17T11:00
43.490703,3.643339,4162463289,7/17/2023 6:06:15 PM
43.268343,5.384994,4420794549,7/17/2023 6:19:32 PM
42.682287,2.900192,4442353760,7/17/2023 9:02:07 AM
43.168201,3.174712,4413520993,7/17/2023 5:56:48 PM
43.763332,5.503614,4413468977,7/18/2023 7:55:17 AM
45.743675,4.818138,4413921772,7/18/2023 10:28:02 AM
44.091095,6.149711,4162498038,7/16/2023 6:30:46 AM
43.049542,3.050396,4413467950,2023-07-16T16:54
44.514808,4.307144,4162491721,2023-07-17T15:51
44.514821,4.307155,4162576332,2023-07-17T15:53
43.866378,3.694035,4413413930,2023-07-15T17:34
43.059522,6.013834,4162494310,7/17/2023 2:15:23 PM
43.705705,4.726662,4162537166,2023-07-18T12:30
43.706501,4.155133,4165571594,7/10/2023 6:47:10 PM
43.706665,4.156173,4165339079,7/10/2023 7:31:07 PM
43.895219,3.51079,4165468710,7/19/2023 1:51:39 PM
43.524811,5.479302,4165457632,2023-07-16T22:14
43.78293,4.831905,4524945126,7/19/2023 12:54:14 PM
41.865903,9.398017,4165519743,7/20/2023 1:09:46 PM
44.861371,4.566867,4442587801,7/20/2023 3:26:54 PM
43.696184,7.269455,4442476801,7/20/2023 4:06:43 PM
45.627638,4.784637,4165852365,7/20/2023 7:13:26 PM
43.737713,6.154528,4165405269,7/17/2023 10:35:23 AM
43.861258,5.56645,4165807366,2023-07-19T21:46
43.76076,4.794671,4165432098,2023-07-19T13:33
44.35125,5.146908,4413443812,2023-07-21T12:17
43.593462,-0.747171,4165503690,2023-07-21T15:25
43.701268,4.138606,4165780329,7/21/2023 11:18:20 AM
43.647625,3.594189,4165379152,7/21/2023 1:38:51 PM
43.589536,5.525442,4165673716,7/22/2023 8:30:05 AM
43.291769,5.591517,4165669465,7/22/2023 2:20:46 PM
45.283377,5.290817,4413643822,2023-07-22T15:40
43.371078,6.292244,4165431230,7/22/2023 5:04:40 PM
43.977826,4.698173,4171855345,7/22/2023 8:22:26 PM
44.663878,-1.016855,4165390137,2023-07-22T09:55
43.593462,-0.747171,4165802333,2023-07-23T11:36
43.194163,6.00932,4165663246,2023-07-23T07:33
43.467143,6.161148,4442616772,2023-07-23T13:45
43.516766,5.462224,4165669273,7/24/2023 11:12:05 AM
43.539992,4.746246,4165376857,7/24/2023 2:06:11 PM
43.640003,3.820441,4165838681,7/24/2023 1:18:04 PM
43.685386,3.87685,4165933382,2023-07-25T08:15
44.637263,3.827021,4165720403,2023-07-15
44.295528,5.000985,4165647488,2023-07-14T14:45
44.295493,5.000963,4165804876,2023-07-14T14:47
44.295537,5.000933,4165796189,2023-07-14T14:50
43.860338,7.298586,4165881038,7/25/2023 5:23:03 PM
43.508822,5.677767,4165965757,2023-07-25T19:13
43.623122,7.038117,4165875977,7/25/2023 1:13:19 PM
43.832345,5.009464,4171204677,7/22/2023 1:11:41 PM
43.484911,5.450853,4171477648,7/26/2023 5:19:46 PM
43.470367,6.170405,4171650782,2023-07-26T14:34
43.469362,6.169877,4442362812,2023-07-26T14:40
43.469362,6.169877,4171491405,2023-07-26T14:41
43.966667,4.266944,4171516771,7/27/2023 8:38:04 AM
45.356931,-1.061774,4171527855,7/19/2023 11:29:20 AM
43.371102,6.292482,4171639859,7/27/2023 11:37:50 AM
44.093723,3.021856,4442474801,7/27/2023 4:25:32 PM
43.526525,5.62864,4171401047,2023-07-27T14:18
43.52813,5.626238,4171207872,2023-07-27T14:32
43.546886,5.389552,4413558019,7/27/2023 5:27:08 PM
43.069431,6.117783,4171615088,7/23/2023 5:08:39 PM
43.008165,6.38541,4171663226,2023-07-12T09:32
43.008479,6.383571,4171676263,2023-07-13T08:49
43.671673,3.846941,4171660807,7/26/2023 8:00:39 AM
44.041845,1.229069,4171771377,2023-07-28T17:46
43.220726,5.737112,4171267759,2023-07-01T09:59
44.29042,3.30936,4413597717,7/29/2023 10:22:41 AM
43.263047,5.572625,4171387087,7/29/2023 4:19:45 PM
44.269467,5.127942,4171149133,7/29/2023 7:03:59 PM
44.269388,5.128028,4171623776,7/29/2023 7:02:25 PM
44.269388,5.128031,4171816415,7/29/2023 7:02:33 PM
43.153406,6.482858,4171805832,7/28/2023 1:52:39 PM
43.72577,7.097678,4442385817,7/30/2023 10:34:25 AM
44.26907,5.1279,4172155355,7/30/2023 1:20:56 PM
44.269087,5.127978,4171351160,7/30/2023 1:21:37 PM
44.26913,5.12787,4171859893,7/30/2023 2:44:27 PM
44.269162,5.127845,4171880950,7/30/2023 2:45:09 PM
44.269222,5.128042,4172115931,7/30/2023 2:53:31 PM
44.45425,4.757172,4442530839,7/30/2023 4:06:05 PM
44.135567,4.808955,4171672234,7/30/2023 5:03:34 PM
44.041845,1.229069,4171935044,2023-07-30T19:00
44.269275,5.127856,4442484816,7/31/2023 10:57:42 AM
44.187717,4.840361,4171883181,7/31/2023 1:41:40 PM
43.620251,6.966884,4171230186,7/31/2023 5:22:07 PM
45.780219,4.898946,4172022458,7/31/2023 6:32:50 PM
43.191601,5.6074,4442496861,7/31/2023 7:14:21 PM
43.067947,5.911433,4171404092,7/31/2023 11:06:10 AM
43.817497,4.505925,4172095370,7/31/2023 9:59:18 PM
43.598866,2.951829,4172062602,2023-07-16
43.77457,3.757493,4172007551,2023-07-22
43.949317,4.805528,4442358831,2023-07-25T15:25
45.844369,5.071863,4171312227,7/22/2023 12:43:59 PM
44.502577,4.250144,4171417160,2023-07-21T17:20
44.557357,-1.241356,4172261977,2023-07-06T14:27
44.557357,-1.241356,4171986934,2023-07-06T14:30
44.557357,-1.241356,4172193495,2023-07-06T14:28
43.641511,7.009186,4172007980,7/30/2023 7:50:37 PM
43.895314,4.701081,4172218567,7/13/2023 11:19:58 AM
43.774679,3.757415,4172023563,2023-07-22
43.774679,3.757415,4172169363,2023-07-22
43.857919,4.418396,4172117841,7/17/2023 7:37:25 PM
43.0074,9.388058,4177002837,7/23/2023 7:08:49 PM
43.113486,5.933167,4177035003,7/16/2023 3:50:27 PM
45.261564,4.58904,4400456184,2023-07-14T14:07
43.641511,7.009186,4400352786,2023-07-16T15:19
43.650985,3.360472,4405616503,2023-07-12T09:37
43.105593,6.021559,4405455672,2023-07-14T11:57
43.105625,6.021503,4405530708,2023-07-14T12:42
43.103941,6.018863,4440614072,2023-07-14T12:23
43.752942,3.754347,4407373731,2023-07-23
43.164328,5.604373,4407621002,2023-07-16T17:31
43.009557,6.382747,4407408350,2023-07-21T09:52
45.203099,5.724418,4414073696,7/16/2023 4:24:25 PM
43.634188,3.873938,4414400403,7/5/2023 9:29:46 AM
43.954313,6.251786,4416997538,2023-07-16T16:28
43.590215,5.189347,4424115279,2023-07-17T19:34
43.963261,4.79952,4424083215,2023-07-25T15:25
43.963261,4.79952,4424168013,2023-07-25T15:26
43.917421,4.890258,4430799393,2023-07-10T19:40
43.917447,4.890472,4431293325,2023-07-10T19:48
43.917432,4.890444,4431254378,2023-07-10T19:48
43.91747,4.890517,4430816326,2023-07-10T19:48
43.917624,4.891337,4431275349,2023-07-11T00:00
43.744613,4.795663,4436180993,7/8/2023 7:48:03 PM
43.918011,4.888283,4438786220,2023-07-11T23:36
43.917958,4.888191,4438636208,2023-07-11T23:37
43.917985,4.888195,4438894128,2023-07-11T23:39
44.356502,4.769866,4438783213,2023-07-16T16:35
43.069772,5.792267,4465487798,7/22/2023 2:44:39 PM
41.546848,8.825932,4500855944,2023-07-21T09:49
43.835362,4.611382,4510131825,2023-07-21T17:30
43.5177,-1.521619,4512295472,7/13/2023 1:30:07 PM
43.47538,-1.4707,4585760457,2023-07-22
43.651598,3.842524,4535659282,2023-07-03T07:10
44.082741,4.994157,4408986625,2023-07-05
44.082729,4.994174,4408728861,2023-07-05
44.082693,4.994078,4408044157,2023-07-05
43.211527,5.521427,4408750897,2023-07-05
43.098319,6.339747,4408828950,2023-07-06
43.456168,3.634756,4408888571,2023-07-06
44.238797,4.119845,4408748957,2023-07-07
43.156921,6.45185,4408849519,2023-07-06
43.166907,6.457472,4408877371,2023-07-07
41.693397,8.918942,4408607231,2023-07-09
43.469958,3.641889,4408505875,2023-07-09
44.065498,4.256993,4409210076,2023-07-07
43.172509,6.449747,4408837493,2023-07-10
43.266084,3.174835,4408722475,2023-07-10
43.266084,3.174835,4409286518,2023-07-10
43.472889,3.625113,4409468600,2023-07-12
44.430908,4.353233,4409021212,2023-07-13
43.493643,3.653738,4409467779,2023-07-14
43.19606,6.565201,4409333890,2023-07-14
44.864705,4.867226,4409058631,2023-07-16
44.437347,1.874767,4409533754,2023-07-17
44.437481,1.87467,4409247263,2023-07-17
43.490703,3.643339,4409798420,2023-07-17
43.654605,4.297453,4409279226,2023-07-19
43.483525,6.325413,4409492815,2023-07-20
44.351166,5.14703,4459712310,2023-07-21
44.333514,4.354694,4409735323,2023-07-20
45.195587,0.76149,4459555648,2023-07-23
44.755775,0.7017,4409779737,2023-07-23
44.388499,4.380881,4409267088,2023-07-24
43.978977,4.525734,4409826748,2023-07-24
44.564935,1.808435,4409984949,2023-07-25
43.510193,6.479643,4409925813,2023-07-25
44.198197,3.242227,4408931830,2023-07-25
43.17,5.73,4409344961,2023-07-26
44.388497,4.380839,4409404944,2023-07-26
44.389923,5.238774,4409943400,2023-07-26
43.991271,3.682442,4409824636,2023-07-28
43.991335,3.68247,4409707094,2023-07-28
44.232391,4.997155,4410034421,2023-07-29
43.776744,4.834298,4410038631,2023-07-18
44.26086,4.20065,4461115969,2023-07-31
43.079616,5.89809,4410059930,2023-07-21
43.087201,5.8975,4409636000,2023-07-21
44.172083,5.287611,4461116125,2023-07-05
44.520125,-0.89928,4459580346,2023-07-15
45.054758,0.994202,4461894617,2023-07-23
44.856295,4.94947,4459671735,2023-07-21
44.90189,4.923615,4460696130,2023-07-20
44.857101,4.947045,4460434837,2023-07-20
44.856295,4.94947,4459848716,2023-07-20
44.856295,4.94947,4459874805,2023-07-20
44.85955,4.956915,4461340484,2023-07-21
44.931942,4.886985,4461656314,2023-07-21
44.904729,4.881057,4460603700,2023-07-21
44.836707,4.966194,4459811600,2023-07-21
44.841219,4.9617,4459794961,2023-07-21
44.845191,4.959347,4459867331,2023-07-21
44.856295,4.94947,4462008532,2023-07-21
44.836913,4.980755,4459872610,2023-07-21
44.844128,4.976942,4459870939,2023-07-21
44.846057,4.971249,4459792488,2023-07-21
44.851321,4.963267,4459805251,2023-07-21
44.859474,4.951057,4459799638,2023-07-21
44.930273,4.885604,4461439007,2023-07-21
44.927351,4.888195,4459777742,2023-07-21
44.928553,4.855438,4460772123,2023-07-21
44.925111,4.856423,4460670328,2023-07-21
44.928795,4.872425,4460409773,2023-07-21
44.930273,4.885604,4461032165,2023-07-21
44.923036,4.86849,4462302646,2023-07-21
44.857101,4.947045,4459838670,2023-07-22
44.856295,4.94947,4461611703,2023-07-22
44.859474,4.951057,4461655543,2023-07-22
44.859474,4.951057,4460696131,2023-07-23
44.857101,4.947045,4461669369,2023-07-23
44.856295,4.94947,4459880485,2023-07-23
44.920186,4.851387,4460641383,2023-07-21
44.920186,4.851387,4459794963,2023-07-21
44.920186,4.851387,4459495623,2023-07-21
44.920186,4.851387,4459629780,2023-07-21
44.920186,4.851387,4461247909,2023-07-21
44.920186,4.851387,4461166656,2023-07-21
44.920186,4.851387,4459539068,2023-07-21
44.53681,4.407996,4461569679,2023-07-25
43.45609,4.90415,4589123120,2023-07-19
45.73392,1.93284,4586503916,2023-07-18
48.80472,2.49368,4593020789,2023-07-29
43.46879,-1.48389,4585760424,2023-07-23
48.78397,2.50473,4593020340,2023-07-16
43.82158,5.37454,4542259812,2023-07-02
43.82695,5.31474,4542259499,2023-07-02
44.06004,4.82735,4542260011,2023-07-04
43.9131,5.05631,4542259454,2023-07-04
43.8517,5.11025,4542259668,2023-07-04
45.49095,4.77422,4549629472,2023-08-08
44.26211,5.10191,4542259482,2023-08-06
44.22228,5.13357,4542259707,2023-08-13
44.06004,4.82735,4542259874,2023-08-11
41.64925,9.32749,4541679851,2023-08-25
41.63241,9.33023,4541768020,2023-08-25
41.62773,9.23705,4541846218,2023-08-25
41.66987,9.18428,4541758668,2023-08-25
41.65129,9.29623,4541795179,2023-08-25
41.65129,9.29623,4541706911,2023-08-25
41.62279,9.29962,4541771131,2023-08-25
41.54303,9.21551,4541777130,2023-08-23
41.53895,9.21401,4541770403,2023-08-23
41.65208,9.29625,4541818833,2023-08-22
41.54838,9.21526,4541768087,2023-08-22
42.29406,9.54704,4541783263,2023-08-21
42.31379,9.54165,4541794945,2023-08-21
42.30007,9.54491,4541749645,2023-08-21
42.36365,9.53004,4541794712,2023-08-21
42.32243,9.53922,4541776962,2023-08-21
42.48102,9.48118,4541845981,2023-08-21
42.49652,9.47068,4541801250,2023-08-21
42.50041,9.46635,4541857358,2023-08-21
42.62785,9.44547,4541718361,2023-08-21
42.62785,9.44547,4541787062,2023-08-21
41.85478,9.4003,4541829691,2023-08-21
41.87746,9.39548,4541829563,2023-08-21
41.88633,9.39428,4541719059,2023-08-21
41.88061,9.39505,4541690249,2023-08-21
41.92141,9.39003,4541741649,2023-08-21
42.62785,9.44547,4541733973,2023-08-21
42.62695,9.42982,4541794550,2023-08-21
41.98478,9.40097,4541689383,2023-08-21
41.98478,9.40097,4541829712,2023-08-21
41.96733,9.39773,4541865185,2023-08-21
41.96431,9.39768,4541857354,2023-08-21
41.99668,9.40284,4541801160,2023-08-21
41.99119,9.4019,4541680148,2023-08-21
42.08136,9.48228,4541741847,2023-08-21
42.07641,9.46676,4541770523,2023-08-21
42.05064,9.42932,4541776338,2023-08-21
42.21414,9.5338,4541786501,2023-08-21
42.19618,9.53157,4541742089,2023-08-21
42.18708,9.53047,4541670298,2023-08-21
42.22498,9.54036,4541758647,2023-08-21
42.25946,9.54736,4541733559,2023-08-21
42.26729,9.54923,4541787242,2023-08-21
41.65267,9.29653,4541795296,2023-08-19
41.65247,9.29639,4541679648,2023-08-18
41.65247,9.29639,4541759233,2023-08-18
41.53271,9.26586,4541741379,2023-08-17
41.65169,9.29616,4541690216,2023-08-17
41.53271,9.26586,4541749758,2023-08-17
41.5322,9.27033,4541669402,2023-08-17
41.5322,9.27033,4541749620,2023-08-17
41.65124,9.29592,4541776922,2023-08-16
41.64213,9.29657,4541800861,2023-08-16
41.64152,9.29724,4541782412,2023-08-16
41.64935,9.32746,4541857513,2023-08-16
41.65689,9.29815,4541801053,2023-08-16
41.65689,9.29815,4541846222,2023-08-16
41.65262,9.29715,4541758908,2023-08-15
41.65944,9.31544,4541864949,2023-08-15
41.64971,9.32753,4541829797,2023-08-15
41.65944,9.31544,4541669962,2023-08-15
41.67903,9.37109,4541819030,2023-08-15
41.65177,9.29601,4541795017,2023-08-14
41.65177,9.29601,4541830015,2023-08-14
41.65177,9.29601,4541858107,2023-08-14
41.65177,9.29601,4541857575,2023-08-14
41.65177,9.29601,4541857379,2023-08-14
41.65537,9.29741,4541795277,2023-08-14
41.65177,9.29601,4541794828,2023-08-14
41.6283,9.29052,4541845606,2023-08-13
41.6283,9.29052,4541680061,2023-08-13
41.6283,9.29052,4541733460,2023-08-13
41.61572,9.28046,4541734300,2023-08-13
41.6283,9.29052,4541758363,2023-08-13
41.58848,9.27407,4541794441,2023-08-13
41.58848,9.27407,4541758946,2023-08-13
41.6519,9.29616,4541750036,2023-08-13
41.6519,9.29616,4541787069,2023-08-13
41.6519,9.29616,4541770369,2023-08-13
41.6519,9.29616,4541758576,2023-08-13
41.65235,9.29636,4541864818,2023-08-12
41.65427,9.29708,4541782941,2023-08-12
41.62684,9.29081,4541733590,2023-08-12
41.62684,9.29081,4541758738,2023-08-12
41.62684,9.29081,4541689693,2023-08-12
41.62223,9.28487,4541718382,2023-08-12
41.61547,9.28067,4541783233,2023-08-12
41.60098,9.26791,4541845952,2023-08-12
41.58734,9.2633,4541689832,2023-08-12
41.58734,9.2633,4541801265,2023-08-12
41.5811,9.27011,4541864691,2023-08-12
41.57888,9.27344,4541776904,2023-08-12
41.57015,9.27223,4541829662,2023-08-12
41.56927,9.26959,4541719057,2023-08-12
41.56719,9.24997,4541864956,2023-08-12
41.56199,9.23749,4541829526,2023-08-12
41.55848,9.23218,4541776437,2023-08-12
41.55192,9.21688,4541800815,2023-08-12
41.55192,9.21688,4541787244,2023-08-12
41.54566,9.20331,4541770813,2023-08-12
41.54566,9.20331,4541767326,2023-08-12
41.54454,9.19988,4541767814,2023-08-12
41.5435,9.18948,4541689439,2023-08-12
41.54454,9.19988,4541690030,2023-08-12
41.54302,9.18517,4541818622,2023-08-12
41.49724,9.13502,4541749988,2023-08-12
41.49626,9.12074,4541670127,2023-08-12
41.49784,9.10084,4541829332,2023-08-12
44.85744,4.94756,4541800454,2023-08-06
44.86559,4.91954,4541718331,2023-08-06
44.85642,4.9496,4541845321,2023-08-05
44.85103,4.94095,4541741873,2023-08-05
44.86573,4.9568,4541864628,2023-08-05
44.86573,4.9568,4541800998,2023-08-05
44.85821,4.95841,4541857411,2023-08-05
44.87247,4.94242,4541864958,2023-08-05
44.85887,4.95811,4541829830,2023-08-05
44.8595,4.94961,4541706658,2023-08-05
44.87838,4.93399,4541669547,2023-08-05
44.85744,4.94756,4541742116,2023-08-06
44.89445,4.8962,4541733767,2023-08-05
44.87247,4.94242,4541787086,2023-08-05
44.87485,4.94604,4541782572,2023-08-05
45.20319,4.87762,4541719064,2023-08-03
45.6427,4.82715,4541818500,2023-08-03
44.85798,4.94691,4541845877,2023-08-03
44.85777,4.94931,4541776558,2023-08-03
45.71505,4.84304,4541795237,2023-08-03
45.70017,4.8456,4541741839,2023-08-03
42.640222,2.770619,4442489855,8/1/2023 6:33:27 PM
43.000172,6.203405,4171447735,8/1/2023 3:30:24 PM
43.981773,4.708075,4172062110,8/2/2023 10:20:27 PM
43.582777,7.126342,4171753449,8/3/2023 3:02:48 PM
43.628847,4.785949,4171457610,8/3/2023 2:50:34 PM
43.629689,4.7805,4172282217,8/3/2023 4:18:31 PM
43.629689,4.7805,4172077009,8/3/2023 4:18:03 PM
43.620235,5.228437,4171777246,2023-08-03T18:24
43.123345,5.81682,4171902019,2023-08-04T16:06
43.765965,3.939998,4171790252,2023-08-05T17:28
43.954447,0.360251,4405148728,8/6/2023 5:50:57 PM
43.501738,-0.67471,4172152240,2023-08-07T12:16
44.057071,4.836653,4171917881,2023-08-07T12:29
43.953777,4.807499,4405010706,8/7/2023 8:50:39 PM
42.513672,2.743379,4172285358,2023-08-08T16:03
43.501738,-0.67471,4177345310,2023-08-09T12:35
44.505918,1.654519,4177413494,2023-08-02T14:08
43.732962,5.476142,4177297224,8/10/2023 11:44:09 AM
43.241588,5.38425,4413837160,8/13/2023 10:30:04 AM
45.786574,4.872227,4177286978,8/14/2023 12:49:47 PM
43.414447,5.468499,4400140805,2023-08-14T19:45
43.927517,4.933234,4400139177,8/18/2023 9:45:50 AM
43.770847,4.794187,4400023655,8/12/2023 3:11:38 PM
43.185844,2.84515,4400025323,8/19/2023 5:34:01 PM
45.619716,4.673029,4405140786,2023-08-08
42.14569,9.554159,4405149281,2023-08-24T16:05
45.375233,4.765884,4405320632,2023-08-06T16:22
45.366189,4.774459,4405463762,2023-08-06T18:02
43.769176,4.101733,4405381712,8/28/2023 9:29:52 AM
43.752325,6.899791,4405605578,2023-08-25T12:12
42.635281,2.767511,4405443853,8/29/2023 6:05:28 PM
43.150243,5.705042,4413406613,8/29/2023 2:24:35 PM
42.634624,2.758537,4407156906,8/31/2023 6:29:03 PM
44.263825,5.0542,4458537379,2023-08-02T20:52
44.179519,5.129122,4465655582,2023-08-03T18:44
45.030984,-1.164545,4500570191,2023-08-05T11:49
44.16,5.148369,4507855745,2023-08-04T08:40
43.956883,4.8039,4507635254,2023-08-05T08:36
43.70215,4.722294,4516718792,2023-08-04T13:12
43.889509,-1.374571,4516819084,2023-08-01T15:41
43.71749,4.767788,4525112797,2023-08-04T14:50
43.773989,4.832377,4525119612,2023-08-04T10:18
44.322487,1.191637,4596996783,8/15/2023 3:18:52 PM
43.490563,4.405888,4597562440,2023-08-01T14:12
43.219888,5.540895,4597073525,2023-08-02T16:43
44.393545,4.192058,4460241439,2023-08-04
45.102917,-1.148986,4459742596,2023-08-02
43.936794,3.971211,4460517711,2023-08-08
45.312116,-0.24723,4409812832,2023-08-07
44.572648,4.504936,4459487552,2023-08-09
43.47422,6.32264,4460519209,2023-08-05
43.4742,6.3226,4460961753,2023-08-05
43.07718,6.148872,4459745899,2023-08-06
43.077194,6.14887,4461675815,2023-08-06
45.008641,-1.195514,4461755085,2023-08-17
43.820195,6.23291,4461585359,2023-08-17
43.838853,6.217575,4461818216,2023-08-17
44.646838,5.289624,4459566035,2023-08-02
43.23457,5.359055,4461662968,2023-08-18
43.779709,6.280845,4461374235,2023-08-18
43.8339,6.226273,4462191023,2023-08-17
44.80703,1.164351,4461957591,2023-08-12
44.856295,4.94947,4459792489,2023-08-03
44.857101,4.947045,4459805252,2023-08-03
44.877358,4.948483,4461078579,2023-08-05
44.872477,4.942946,4461630883,2023-08-05
44.895589,4.894454,4459558441,2023-08-05
44.857101,4.947045,4459523864,2023-08-06
44.878453,4.936788,4460684707,2023-08-05
44.859474,4.951057,4461328458,2023-08-05
44.85955,4.956915,4460772124,2023-08-05
44.872477,4.942946,4459795783,2023-08-05
44.857603,4.959941,4461828242,2023-08-05
44.866804,4.958889,4459671736,2023-08-05
44.866804,4.958889,4459657075,2023-08-05
44.850297,4.943758,4461159532,2023-08-05
44.856295,4.94947,4459604980,2023-08-05
44.865576,4.919718,4459838671,2023-08-06
44.857101,4.947045,4461611704,2023-08-06
44.033782,3.735142,4460112548,2023-08-10
43.4757,-1.47136,4585760387,2023-08-17
45.77885,4.99574,4541706364,2023-09-02
43.293203,3.49286,4407332261,2023-09-02T16:04
43.669915,7.149188,4442475978,9/14/2023 9:58:15 AM
43.625439,3.87051,4413764900,9/14/2023 5:06:05 PM
43.654596,3.337937,4420833751,9/12/2023 2:04:39 PM
43.135979,6.016838,4440599995,9/27/2023 6:47:58 PM
43.773445,4.007216,4430644190,2023-09-12T15:07
43.647845,3.870637,4440626183,2023-09-29T15:15
43.517052,7.040829,4461978957,2023-09-07
44.465755,4.414633,4460944818,2023-09-09
44.465729,4.414666,4461742286,2023-09-09
44.000587,4.37211,4460725555,2023-09-11
43.70964,-1.27068,4569513360,2023-09-01
43.521368,7.052218,4522566269,2023-10-01
44.57347,-1.22119,4588763397,2023-01-01/2023-11-10
43.634415,3.852279,4076217601,2/12/2022 11:16:59 AM
43.657695,3.985837,3743114453,2/22/2022 5:27:57 PM
43.811043,3.742865,3759591826,2022-02-24
43.753422,3.716245,4076264547,3/21/2022 10:17:29 PM
43.631847,3.269664,4075732590,2022-03-19T14:38
44.44008,1.00197,4574306344,2022-03-07
43.508298,5.467222,4076220556,4/13/2022 4:39:23 PM
42.698786,2.904695,3764537825,4/24/2022 8:50:30 PM
44.15624,1.73661,3944317495,2022-04-16
43.631621,3.863449,3860363520,2022-05-10T12:40
44.11196,5.10687,4149860538,2022-06-24
43.5123,3.17376,4588398785,2022-06-28
42.19312,9.08717,4051674258,2022-06-22
44.2172,1.45326,4588567582,2022-06-20
43.76483,3.82635,4588700644,2022-06-24
43.42519,5.80871,4087055491,2022-06-21
43.74459,3.729221,3858514370,2022-06-11
44.514915,4.306139,3860027646,2022-06-13T12:19
43.638908,3.864921,3859652682,2022-06-14T18:14
43.545562,3.815775,3858724821,2022-06-13T09:17
43.915768,3.768473,3860530990,2022-06-15T12:28
43.834083,3.88338,3860154207,2022-06-18T11:55
43.690422,3.87593,3860007211,6/18/2022 1:19:31 PM
42.637517,2.763796,3860519260,6/18/2022 4:07:39 PM
43.395664,5.053792,3859590385,6/19/2022 12:19:41 PM
43.323019,2.531763,4055043437,2022-06-20T11:06
43.371073,6.292191,3881580463,6/20/2022 1:58:31 PM
44.809337,0.169455,4054837457,6/20/2022 4:24:01 PM
43.826542,3.769878,4054773456,2022-06-20T22:48
43.637247,3.862129,3902834451,2022-06-20
43.638359,3.862923,3902367429,2022-06-20
43.690308,3.87567,4055047445,6/21/2022 6:50:06 PM
45.790142,4.881257,3881812443,6/21/2022 11:20:24 AM
43.234753,2.775647,4054932426,6/22/2022 11:19:19 AM
44.514881,4.30979,4054728430,2022-06-21T17:32
43.953257,4.807527,4054727445,2022-06-18T15:57
43.146008,5.75463,4054738456,6/23/2022 4:44:37 PM
43.830079,3.623935,3858732909,2022-06-21T17:26
43.756626,5.600229,4126974769,6/22/2022 9:16:19 AM
44.37039,1.179322,4055027431,6/24/2022 11:33:50 PM
43.271835,5.471848,4430820878,2022-06-25T16:10
43.317963,2.522407,4516150996,6/25/2022 1:43:58 PM
43.664216,3.881356,4055034442,2022-06-25T07:12
43.192483,5.613369,3860586231,6/25/2022 6:33:57 PM
43.192483,5.613369,3859864232,6/25/2022 6:33:57 PM
43.807398,3.664351,3859488198,6/25/2022 12:19:48 PM
43.814959,3.767452,3858641249,2022-06-25T06:54
42.007926,9.207758,4153553410,6/27/2022 5:35:13 PM
43.586351,5.018348,3860710415,6/28/2022 10:02:46 AM
43.005636,6.11137,3858809510,6/27/2022 3:55:20 PM
45.140232,1.157175,4067289606,6/29/2022 12:54:20 PM
43.632208,3.866925,4076290694,6/29/2022 1:16:34 PM
45.719601,4.805354,3873531813,6/29/2022 5:42:40 PM
44.450642,4.308704,4055063438,2022-06-25T14:07
43.123349,5.816893,3872990884,2022-06-29T18:00
43.639097,5.164464,3963364498,2022-06-26T18:25
42.686065,2.896633,3873423638,2022-06-25T15:23
45.068958,4.839054,4055049450,2022-06-27T14:00
43.813857,4.653366,4067360600,2022-06-28T15:00
43.754552,4.79927,3874005927,2022-06-08T12:54
42.19724,9.09937,4050817055,2022-06-22
43.139615,3.094212,4111939103,2022-06-27T10:00
43.612598,5.751313,4153617633,2022-06-24T13:08
43.4608,3.27766,4588566359,2022-06-29
44.025077,1.663212,4400075789,2022-06-27T00:30
43.916424,4.179128,4525177156,2022-06-15T20:00
43.24697,6.12662,4570755578,2022-06-22
44.492856,1.033358,3905076075,2022-06-16
44.638004,4.638348,3904429227,2022-06-27
44.187456,4.525067,3905829206,2022-06-30
43.774501,4.830996,3905330567,2022-06-23
43.756031,4.804287,3905995979,2022-06-08
44.039347,4.82813,3906386209,2022-06-23
44.039057,4.827413,3905994309,2022-06-23
44.992364,-1.162527,3997374826,2022-06-19
42.37317,8.63523,4051006215,2022-06-27
44.07602,4.84163,4086876988,2022-06-14
43.24697,6.12662,4570755342,2022-06-22/2022-06-23
43.60816,5.69377,4086901275,2022-06-30
44.80934,0.16946,4573995355,2022-06-20
43.52123,5.56598,4086945722,2022-06-10
43.84893,4.9587,4086944292,2022-06-10
43.89391,4.96024,4087089315,2022-06-10
44.05916,5.99139,4570903439,2022-06-20
44.32378,1.15107,4587922463,2022-06-01
43.41558,3.45665,4588547624,2022-06-29
44.18012,0.75284,4081612643,2022-06-24
43.64712,0.65828,4588635470,2022-06-18
43.93659,5.08629,4087023013,2022-06-11
42.19523,9.0929,4051752728,2022-06-22
43.29497,5.61752,4087060428,2022-06-13
43.41496,6.17871,4086970897,2022-06-20
43.76483,3.82635,4588540040,2022-06-24
44.07602,4.84163,4086908525,2022-06-15
43.39859,6.72137,4547184738,2022-06-17
43.44924,4.6363,4086926208,2022-06-24
44.07602,4.84163,4087080082,2022-06-14
43.80511,4.94932,4150029339,2022-06-15
44.26737,1.45447,4548459215,2022-06-20
44.58266,1.84484,4588491584,2022-06-25
43.4942,3.19672,4588377616,2022-06-28
42.19631,9.09517,4050717323,2022-06-22
43.39859,6.72137,4546925631,2022-06-24
42.19773,9.11265,4051076412,2022-06-22
45.14023,1.15718,4574955301,2022-06-29
43.89591,5.15312,4047031503,2022-06-06
43.93797,5.11171,4047031850,2022-06-11
43.89252,5.11485,4047031857,2022-06-11
43.82411,5.22101,4047031996,2022-06-17
44.20393,4.73997,4047031792,2022-06-23
43.87902,5.38838,4047031781,2022-06-25
43.87902,5.38838,4047031974,2022-06-25
43.8506,5.58995,4047031571,2022-06-26
43.93797,5.11171,4047031981,2022-06-22
43.87902,5.38838,4047031662,2022-06-25
43.87902,5.38838,4047031629,2022-06-25
43.70464,5.64289,4047031793,2022-06-27
43.93797,5.11171,4047032081,2022-06-30
45.63384,4.82107,4149181345,2022-06-19
45.63272,4.82043,4149103502,2022-06-19
45.63996,4.82548,4149175047,2022-06-19
43.8517,5.11025,4046904192,2022-06-15
44.37783,4.49607,4046904847,2022-06-25
43.85053,5.03612,4046903393,2022-06-02
44.83218,1.70648,4586538363,2022-07-14
48.8122,2.42827,4051705722,2022-07-04
42.24569,9.54552,4050736464,2022-07-14
43.39859,6.72137,4547390497,2022-07-27
44.89937,0.70062,4576012311,2022-07-12
43.7211,2.82382,4594586146,2022-07-19
44.71896,1.56119,4588367506,2022-07-27
43.71411,2.86311,4594586079,2022-07-13
43.112662,5.969294,3902202805,7/1/2022 9:04:14 PM
43.493066,3.67546,4054852428,2022-07-02T10:14
43.539935,5.650946,4126961033,7/2/2022 7:19:41 PM
43.772915,3.838376,3873044857,7/3/2022 7:47:13 AM
43.515647,3.701319,3858796093,7/3/2022 12:35:31 PM
44.59684,4.260168,3872918888,7/3/2022 3:45:13 PM
43.600561,1.439477,3860303115,2022-07-03
43.887808,5.828523,4054794417,2022-07-05T10:34
44.596876,4.260612,3873525913,7/8/2022 11:21:36 AM
44.544575,4.345401,3988492504,2022-07-06T19:48
43.692198,5.503519,3873457421,7/9/2022 2:12:24 PM
44.278885,4.194824,3873616254,2022-07-09T11:18
43.097313,5.829672,3873800480,7/9/2022 2:08:45 PM
43.505412,5.545478,3873214833,7/9/2022 8:16:44 PM
45.879592,1.053767,3873254003,2022-07-11T14:00
44.89937,0.700623,4055024429,7/12/2022 9:33:09 AM
44.055692,4.833058,3873182388,7/12/2022 12:48:07 PM
43.743522,4.220695,4054756448,2022-07-11T06:15
43.677588,5.064917,3873819245,7/13/2022 9:05:50 AM
43.732783,3.907492,3873675463,2022-07-14T11:18
43.690833,3.872908,3947335685,7/14/2022 9:42:52 PM
43.507482,7.046483,3873967327,7/14/2022 1:54:47 PM
43.176862,5.922863,3873034233,7/15/2022 12:10:22 PM
43.462846,3.594802,4054802468,2022-07-15T12:34
43.121717,6.125156,3873300106,7/3/2022 6:22:21 PM
42.67615,3.033114,3873630576,7/16/2022 8:00:30 AM
43.622037,7.128586,3873586854,7/17/2022 11:09:47 AM
44.429445,4.859675,3874119601,7/17/2022 12:55:56 PM
43.410267,6.398178,3874076224,7/17/2022 5:01:51 PM
44.4222,4.926583,4054918441,2022-07-17T18:43
44.4222,4.926583,4054762438,2022-07-17T18:44
44.4222,4.926583,4054785474,2022-07-17T18:59
43.767599,4.103143,3923626543,7/11/2022 6:28:55 PM
42.842457,2.912677,4054845473,7/14/2022 11:07:07 AM
43.109799,1.227954,3881357456,2022-07-18T11:51
43.834366,3.691731,3873900933,2022-07-15
43.271746,5.474081,4067312587,2022-07-19T14:16
43.272911,5.478494,4067222581,2022-07-19T15:19
43.272911,5.478494,4067155609,2022-07-19T15:46
43.277885,5.484219,4145560447,2022-07-19T15:41
43.163249,6.028671,3874031603,2022-07-08
43.163204,6.029085,3873074747,2022-07-08T16:30
43.16356,6.029009,3874173325,2022-07-08T16:35
43.740137,7.257563,3873751978,7/20/2022 11:47:01 AM
43.000376,6.16753,3873078626,7/9/2022 1:42:53 PM
44.119307,3.597959,3947468672,7/17/2022 1:32:21 PM
45.771903,4.824918,3873198721,7/21/2022 1:16:34 PM
43.630358,2.50208,3873396837,7/21/2022 6:49:38 PM
43.88025,4.92822,3874001657,7/21/2022 2:15:33 PM
43.870042,3.697647,3873740034,2022-07-18T18:20
44.409238,-0.815319,3902098938,7/23/2022 1:04:37 PM
44.837212,5.756668,3873202020,2022-07-23T11:52
42.634771,2.765491,3874091252,7/6/2022 4:02:31 PM
43.781355,4.584999,4133618428,7/25/2022 10:30:26 AM
44.803119,5.801256,3874020636,2022-07-25T12:34
43.862822,3.98286,3874109961,7/24/2022 10:23:30 PM
43.000991,6.196563,3873469520,2022-07-20T17:08
43.698441,7.037719,4054733466,2022-07-09T15:35
43.372192,1.545683,3873135902,7/25/2022 6:58:15 PM
44.509177,4.219059,3873442692,7/26/2022 3:02:50 PM
43.345613,5.392679,3881401700,2022-07-24T06:36
43.522225,5.465383,4399909373,7/27/2022 8:09:09 PM
41.707979,9.372315,3881360639,7/28/2022 11:33:20 AM
43.516128,7.056367,3881520839,7/26/2022 4:45:28 PM
42.636556,2.768264,3881778810,7/28/2022 9:31:35 PM
42.646107,2.781059,3902636981,7/29/2022 5:26:56 PM
42.637709,2.766617,3902226427,7/30/2022 5:17:59 PM
44.107561,3.51582,3888864689,2022-07-24
43.586297,2.955609,3888720772,2022-07-07T19:01
43.622254,3.00471,3888987748,2022-07-13T20:48
43.622254,3.00471,3888857821,2022-07-13T20:48
42.401408,9.535661,4399962476,7/23/2022 2:27:06 PM
44.100111,4.659861,4075591717,2022-07-05T15:18
44.387333,4.284379,3892380789,2022-07-07T12:48
44.471688,1.65864,4039395898,2022-07-27T14:01
42.32742,9.00107,4051170390,2022-07-24
43.600945,7.092884,4062601328,2022-07-15T13:43
43.93999,4.89953,4086907921,2022-07-06
41.49206,8.97019,4051502107,2022-07-15
43.824956,7.12367,4129972023,2022-07-08T03:24
42.05724,9.37865,4051502258,2022-07-14
43.683599,3.876686,4430704135,2022-07-03
43.59541,2.83809,4594584473,2022-07-06
42.87434,2.20794,4548636568,2022-07-28
43.67349,2.5922,4594589345,2022-07-20
44.1896,5.84652,4086928698,2022-07-20
44.23009,0.15739,4541883622,2022-07-07
45.00544,1.64481,4542272085,2022-07-27
43.453239,4.429072,3996185214,2022-07-03
43.955704,4.805398,4408108612,2022-07-08
43.951584,4.54616,3906262818,2022-07-13
44.8,0.71,3905241262,2022-07-15
43.840252,4.620284,3906983116,2022-07-14
44.075456,1.611916,3906963357,2022-07-16
43.948139,4.548203,3905948691,2022-07-19
43.947887,4.548196,3905618556,2022-07-19
44.36805,1.482,4588368115,2022-07-12
43.724091,4.718561,3904113464,2022-07-23
43.94809,4.548285,3906865294,2022-07-23
43.945595,4.537929,3905910905,2022-07-21
44.41328,4.138901,3906373628,2022-07-24
43.060183,5.854948,3907044988,2022-07-29
43.264221,3.174896,3905831238,2022-07-30
43.723164,4.808971,3904584762,2022-07-24
44.920753,1.332479,3907290014,2022-07-30
43.579655,2.96471,3906213943,2022-07-26
43.976096,4.500585,4408193751,2022-07-18
42.70814,9.4519,4051602786,2022-07-25
44.413202,4.166574,3995870161,2022-07-20
44.39551,4.170265,3995628101,2022-07-20
44.39551,4.170265,3995781140,2022-07-20
44.39551,4.170265,3996396356,2022-07-20
44.39551,4.170265,3997746091,2022-07-20
44.39551,4.170265,3997723809,2022-07-20
44.39551,4.170265,3997679006,2022-07-20
44.39551,4.170265,3995755219,2022-07-20
44.39551,4.170265,3996634999,2022-07-20
44.39551,4.170265,3996433400,2022-07-20
44.39551,4.170265,3996228732,2022-07-20
44.39551,4.170265,3997549155,2022-07-20
44.39551,4.170265,3995704083,2022-07-20
44.39551,4.170265,3995915332,2022-07-20
44.39551,4.170265,3997717333,2022-07-20
44.39551,4.170265,3997341877,2022-07-20
44.39551,4.170265,3996962978,2022-07-20
44.39551,4.170265,3997673750,2022-07-20
44.39551,4.170265,3997728186,2022-07-20
44.39551,4.170265,3997323043,2022-07-20
44.39551,4.170265,3996182733,2022-07-20
44.39551,4.170265,3996648019,2022-07-20
44.39551,4.170265,3997234004,2022-07-20
44.39551,4.170265,3995210192,2022-07-20
44.39551,4.170265,3995216648,2022-07-20
44.39551,4.170265,3995751302,2022-07-20
44.39551,4.170265,3996035005,2022-07-20
44.39551,4.170265,3997225100,2022-07-20
44.39551,4.170265,3996202169,2022-07-20
44.39551,4.170265,3997503637,2022-07-20
44.39551,4.170265,3997107598,2022-07-20
44.39551,4.170265,3996652033,2022-07-20
43.927982,4.615164,4408190833,2022-07-22
43.767127,4.856987,4408042789,2022-07-22
43.9874,-0.34977,4148597418,2022-07-13
43.47015,5.8109,4086880528,2022-07-07
44.87281,0.9398,4151468615,2022-07-12
41.49083,8.96965,4051668881,2022-07-15
42.38142,9.14426,4051654196,2022-07-24
42.7494,1.94076,4548636620,2022-07-21
43.57141,2.285,4586862321,2022-07-13
42.03614,9.39182,4051028432,2022-07-14
42.69089,2.2108,4548459131,2022-07-21
42.03391,9.41909,4051041445,2022-07-14
43.55267,2.61636,4594588130,2022-07-12
42.86229,-0.39278,4149558410,2022-07-24
43.34911,1.46894,4541793251,2022-07-18
43.71091,2.87293,4594584674,2022-07-13
42.60003,9.43851,4051985216,2022-07-14
43.93999,4.89953,4086898839,2022-07-06
43.40959,6.72535,4547788330,2022-07-28
41.48991,8.96887,4051133416,2022-07-15
43.74237,2.8275,4594587608,2022-07-19
43.66633,2.62637,4594587497,2022-07-14
43.72437,2.87539,4594584887,2022-07-13
44.79633,0.29058,4152564291,2022-07-11
43.38568,1.58277,4568967497,2022-07-20
42.09616,9.30614,4051851525,2022-07-14
42.71136,9.43546,4051856058,2022-07-23
43.59329,1.45035,4541799647,2022-07-15
42.45638,9.50178,4051256525,2022-07-14
43.66095,2.56356,4594585423,2022-07-30
44.36428,1.47745,4588367708,2022-07-12
44.484,1.64555,4568530718,2022-07-25
42.70839,9.43812,4052048677,2022-07-17
42.40684,9.53099,4051316528,2022-07-14
44.34223,1.46617,4546442560,2022-07-12
42.09061,9.1973,4052051337,2022-07-14
43.7409,7.19083,4088341357,2022-07-22
42.6512,9.44098,4051324414,2022-07-14
44.07602,4.84163,4087025463,2022-07-13
42.98107,-0.42273,4149558666,2022-07-24
41.49139,8.96938,4051347786,2022-07-15
41.49031,8.96542,4051957038,2022-07-15
42.09991,9.27576,4051342273,2022-07-14
42.37873,8.75426,4051964844,2022-07-26
41.49224,8.96947,4051376942,2022-07-15
42.61499,9.43745,4051350795,2022-07-14
43.68683,2.68908,4594585489,2022-07-14
43.67887,2.67634,4594587708,2022-07-14
44.48398,1.55572,4568530690,2022-07-19
41.49019,8.96639,4051401311,2022-07-15
43.98274,5.02564,4086881653,2022-07-05
43.62395,2.30904,4568578057,2022-07-11
42.08325,9.36216,4051437633,2022-07-14
43.71918,2.78309,4594588070,2022-07-19
43.57474,2.54739,4594584475,2022-07-12
42.09436,9.31725,4050775704,2022-07-14
43.72937,2.72297,4594585962,2022-07-19
43.37045,1.41849,4569339211,2022-07-23
44.28273,5.72582,4086802171,2022-07-09
42.08913,9.50503,4051771469,2022-07-14
42.42672,9.52624,4050796740,2022-07-14
41.48977,8.96783,4051490239,2022-07-15
43.39209,5.79293,4151674678,2022-07-13
43.75019,2.81791,4594588143,2022-07-19
43.24314,3.24692,4569025502,2022-07-01
42.01871,9.40753,4050838474,2022-07-14
41.49174,8.96885,4051804614,2022-07-15
42.7113,9.45416,4051495046,2022-07-24
41.49072,8.96622,4051180803,2022-07-15
42.18025,9.22168,4051189784,2022-07-21
42.10224,9.24371,4051560272,2022-07-14
43.68413,2.7007,4594584793,2022-07-14
44.4659,1.54677,4568530880,2022-07-19
44.99693,1.15309,4151468505,2022-07-25
44.95467,1.6631,4586538752,2022-07-14
44.18628,5.97153,4087072759,2022-07-18
43.70211,2.86002,4594587329,2022-07-13
43.42677,5.74703,4087005251,2022-07-12
44.07385,4.96644,4086849154,2022-07-13
44.00891,1.89903,4569025678,2022-07-06
43.56003,2.31667,4586862402,2022-07-13
44.11884,4.968,4086868400,2022-07-21
42.36578,9.52944,4051030139,2022-07-14
42.38622,9.53008,4051699135,2022-07-14
42.79882,-0.55443,4149542971,2022-07-15
43.40936,6.71063,4547184501,2022-07-26
44.35642,1.4756,4588367352,2022-07-12
42.22878,9.5436,4051087959,2022-07-14
43.68818,3.81818,4152057642,2022-07-20
41.49142,8.96813,4051096346,2022-07-15
43.72617,2.72861,4594585200,2022-07-19
42.58016,9.43987,4051759205,2022-07-14
42.68949,9.44741,4051145482,2022-07-14
43.39447,5.19006,4086990304,2022-07-08
42.38039,9.53014,4051788352,2022-07-14
43.44547,2.08764,4588554415,2022-07-13
43.72814,0.31077,4594602930,2022-07-21
43.57202,3.83235,4052090376,2022-07-01
42.50816,9.47113,4051828475,2022-07-14
43.42531,6.84805,4547120693,2022-07-19
43.56738,6.4984,4049097331,2022-07-26
43.99472,1.71291,4569026147,2022-07-06
42.52618,9.45598,4051223740,2022-07-14
44.05781,7.15169,4087114933,2022-07-03
43.99322,1.70665,4569389368,2022-07-22
43.21964,6.66039,4087081549,2022-07-29
42.30064,9.54465,4051260185,2022-07-14
43.34824,5.24996,4087010581,2022-07-19
43.7409,7.19083,4088341335,2022-07-22
42.10461,9.51521,4051873466,2022-07-14
42.07287,9.19156,4051586530,2022-07-14
42.46863,9.48855,4051281335,2022-07-14
43.3495,5.18835,4086947676,2022-07-18
45.01435,1.59396,4544533503,2022-07-14
43.52441,1.20478,4541976486,2022-07-22
43.17471,6.65754,4086947913,2022-07-04
42.17572,9.52934,4051920535,2022-07-14
42.06986,9.18417,4052048085,2022-07-14
42.49497,9.47052,4051933246,2022-07-14
42.47976,9.48095,4051646448,2022-07-14
42.06951,9.45263,4051934198,2022-07-14
42.4389,9.51486,4051940480,2022-07-14
42.93545,2.96733,4541823631,2022-07-06
42.34709,9.53301,4051355128,2022-07-14
42.26538,9.54874,4051368326,2022-07-14
42.44913,3.08274,4542080395,2022-07-07
43.55567,2.61706,4594585856,2022-07-12
44.23009,0.15739,4542612436,2022-07-07
42.09953,9.2112,4051457770,2022-07-14
42.09485,9.33906,4051482475,2022-07-14
43.73605,7.31476,4087041150,2022-07-18
42.71274,9.44491,4050799045,2022-07-23
42.12627,9.51031,4050836627,2022-07-14
43.55073,2.58257,4047041472,2022-07-12
43.55073,2.58257,4047040629,2022-07-12
43.55073,2.58257,4047040439,2022-07-12
43.69352,2.86055,4047042292,2022-07-13
43.69352,2.86055,4047041626,2022-07-13
43.69352,2.86055,4047040626,2022-07-13
43.69352,2.86055,4047040868,2022-07-13
43.69741,2.68844,4047040419,2022-07-14
43.69741,2.68844,4047041215,2022-07-14
43.69741,2.68844,4047041265,2022-07-14
43.69741,2.68844,4047041406,2022-07-14
43.97962,5.30901,4047031487,2022-07-02
43.73029,5.38353,4047031599,2022-07-04
43.76171,5.20072,4047031750,2022-07-05
43.93797,5.11171,4047031497,2022-07-12
44.18534,5.33215,4047031471,2022-07-13
44.21646,5.02872,4047031536,2022-07-01
43.17822,0.39754,4046944671,2022-07-15
43.17826,0.39762,4046933712,2022-07-18
43.18361,0.39149,4046945089,2022-07-17
42.71226,1.4088,4149350036,2022-07-30
45.06,1.65485,4148394022,2022-07-25
43.0431,0.20871,4046933513,2022-07-31
42.59549,1.77728,4047040560,2022-07-16
43.69352,2.86055,4047041242,2022-07-19
43.74321,2.81534,4047041572,2022-07-19
43.74321,2.81534,4047040344,2022-07-19
43.71942,2.77603,4047041829,2022-07-19
43.69741,2.68844,4047041998,2022-07-19
43.69741,2.68844,4047040898,2022-07-19
43.69741,2.68844,4047040648,2022-07-20
43.65855,2.53112,4149230631,2022-07-20
43.65855,2.53112,4149230341,2022-07-20
41.49098,8.96707,4050847241,2022-07-15
41.49026,8.96959,4051181893,2022-07-15
43.17471,6.65754,4086832999,2022-07-15
42.82457,1.46683,4569090389,2022-07-23
44.17482,5.37208,4047031377,2022-07-19
44.21572,4.80182,4047031303,2022-07-24
43.93544,4.84111,4047031711,2022-07-30
42.71275,9.45389,4050873606,2022-07-14
43.93776,5.02404,4087059955,2022-07-05
43.98274,5.02564,4086837984,2022-07-05
43.38887,1.5809,4569025975,2022-07-20
43.5542,2.28152,4586862591,2022-07-13
42.74347,1.95674,4548874652,2022-07-21
45.75825,4.90829,4149158878,2022-07-26
44.62231,4.39061,4149178336,2022-07-21
44.63617,4.37813,4149161896,2022-07-21
44.62539,4.38387,4149201255,2022-07-21
44.63925,4.42705,4149148066,2022-07-21
44.65394,4.44483,4149161442,2022-07-21
44.67014,4.45701,4149207337,2022-07-21
44.69981,4.50713,4149221415,2022-07-21
44.68043,4.4613,4149162264,2022-07-21
44.68633,4.46715,4149127397,2022-07-21
44.71705,4.48997,4149197345,2022-07-21
44.69404,4.47613,4149120217,2022-07-21
44.68427,4.52206,4149182186,2022-07-21
44.39776,4.17382,4149128281,2022-07-20
44.39776,4.17382,4149161379,2022-07-20
44.39776,4.17382,4149186676,2022-07-20
44.39776,4.17382,4149201296,2022-07-20
44.39776,4.17382,4149161683,2022-07-20
44.39776,4.17382,4149178543,2022-07-20
44.39776,4.17382,4149158304,2022-07-20
44.39776,4.17382,4149128255,2022-07-20
44.39776,4.17382,4149127510,2022-07-20
44.39776,4.17382,4149193963,2022-07-20
44.39776,4.17382,4149072661,2022-07-20
44.39776,4.17382,4149119557,2022-07-20
44.39776,4.17382,4149204532,2022-07-20
44.61511,4.40424,4149215357,2022-07-20
44.41294,4.16559,4149169909,2022-07-20
44.61351,4.40701,4149054383,2022-07-20
44.39776,4.17382,4149211539,2022-07-20
44.39776,4.17382,4149175021,2022-07-20
44.39776,4.17382,4149181439,2022-07-20
44.39776,4.17382,4149170231,2022-07-20
44.39776,4.17382,4149161684,2022-07-20
44.39776,4.17382,4149073044,2022-07-20
44.39776,4.17382,4149204960,2022-07-20
44.39776,4.17382,4149187191,2022-07-20
44.39776,4.17382,4149135418,2022-07-20
44.39776,4.17382,4149191131,2022-07-20
44.39776,4.17382,4149200430,2022-07-20
44.39776,4.17382,4149182232,2022-07-20
44.39776,4.17382,4149147356,2022-07-20
44.39776,4.17382,4149169965,2022-07-20
44.39776,4.17382,4149120041,2022-07-20
44.39776,4.17382,4149150647,2022-07-20
44.39776,4.17382,4149119756,2022-07-20
44.39776,4.17382,4149128296,2022-07-20
44.67634,4.91469,4149103628,2022-07-19
44.67634,4.91469,4149161814,2022-07-19
44.67634,4.91469,4149211954,2022-07-19
44.67909,4.91771,4149072777,2022-07-19
44.67634,4.91469,4149193432,2022-07-19
44.67634,4.91469,4149204775,2022-07-19
44.67634,4.91469,4149103799,2022-07-19
44.67634,4.91469,4149193669,2022-07-19
44.67634,4.91469,4149197869,2022-07-19
44.67634,4.91469,4149119652,2022-07-19
44.85895,4.94676,4149136294,2022-07-16
44.866,4.92971,4149103757,2022-07-16
44.60171,5.45862,4149135855,2022-07-16
44.69199,5.2161,4149197601,2022-07-16
44.56785,5.50478,4149207506,2022-07-16
44.56785,5.50478,4149162071,2022-07-16
44.56692,5.51256,4149198175,2022-07-16
44.56692,5.51256,4149119903,2022-07-16
44.56692,5.51256,4149103734,2022-07-16
44.56785,5.50478,4149055112,2022-07-16
44.20954,5.95215,4149148227,2022-07-15
44.211,5.96114,4149182038,2022-07-15
44.211,5.96114,4149170246,2022-07-15
44.211,5.96114,4149136009,2022-07-15
44.20608,5.97586,4149148289,2022-07-15
44.21391,5.98277,4149186738,2022-07-15
44.21062,5.98065,4149181732,2022-07-15
44.23597,6.02055,4149193523,2022-07-15
44.48319,5.60625,4149103996,2022-07-15
44.26773,5.77619,4149193677,2022-07-15
44.51243,5.63077,4149211636,2022-07-15
44.50243,5.5887,4149215325,2022-07-15
44.20049,5.94374,4149193925,2022-07-15
44.20954,5.95215,4149190559,2022-07-15
44.20619,5.94786,4149194053,2022-07-15
44.2434,6.06553,4149193449,2022-07-15
44.2434,6.06553,4149169759,2022-07-15
44.24812,6.07519,4149088057,2022-07-15
44.24785,6.08041,4149186316,2022-07-15
44.21965,5.99004,4149135306,2022-07-15
44.23743,5.84988,4149182243,2022-07-14
44.42926,5.71686,4149174925,2022-07-14
44.22466,5.87101,4149103499,2022-07-14
44.22466,5.87101,4149128224,2022-07-14
44.22466,5.87101,4149197860,2022-07-14
45.75899,4.92256,4149143920,2022-07-13
44.85825,4.94887,4149184531,2022-07-10
44.8576,4.94761,4149054337,2022-07-09
44.8576,4.94761,4149147738,2022-07-09
44.85337,4.94492,4149205045,2022-07-09
44.85193,4.93704,4149119589,2022-07-09
44.859,4.91538,4149181363,2022-07-09
44.86016,4.90725,4149190486,2022-07-09
44.84214,4.88368,4149205195,2022-07-09
44.85449,4.84619,4149207494,2022-07-09
44.85626,4.84658,4149136241,2022-07-09
44.85449,4.84619,4149219155,2022-07-09
44.85449,4.84619,4149204908,2022-07-09
44.85679,4.94954,4149186917,2022-07-09
44.85831,4.94986,4149087595,2022-07-09
44.85754,4.94754,4149197819,2022-07-08
44.8576,4.94761,4149119576,2022-07-09
44.8576,4.94761,4149148288,2022-07-09
44.72923,4.78588,4149119989,2022-07-08
44.72923,4.78588,4149143940,2022-07-08
44.72667,4.78497,4149216156,2022-07-08
44.72667,4.78497,4149185229,2022-07-08
44.3529,4.69255,4149127872,2022-07-08
44.3529,4.69255,4149187196,2022-07-08
44.72923,4.78588,4149178487,2022-07-08
44.72923,4.78588,4149135347,2022-07-08
44.72731,4.78673,4149190574,2022-07-08
44.72923,4.78588,4149221919,2022-07-08
44.72923,4.78588,4149103693,2022-07-08
44.72731,4.78673,4149148009,2022-07-08
44.72667,4.78497,4149200724,2022-07-08
44.72667,4.78497,4149175030,2022-07-08
44.72731,4.78673,4149215670,2022-07-08
44.72731,4.78673,4149054959,2022-07-08
43.85053,5.03612,4046903571,2022-07-12
42.2096,9.53401,4050914771,2022-07-14
42.28847,9.54923,4050924408,2022-07-14
43.89591,5.15312,4557629377,2022-07-07
42.82441,-0.53714,4149548960,2022-07-19
43.31646,1.44235,4541831104,2022-07-14
42.09848,9.22257,4051604568,2022-07-14
43.66459,2.56706,4594585393,2022-07-20
43.7409,7.19083,4088341328,2022-07-22
43.35101,1.47433,4568808716,2022-07-14
42.81774,2.82329,4541846337,2022-07-07
44.23009,0.15739,4542612606,2022-07-07
42.43712,3.15592,4541831225,2022-07-07
42.15832,9.51723,4051680159,2022-07-14
42.32799,9.53791,4051949724,2022-07-14
42.09978,9.21108,4051730976,2022-08-06
42.66142,9.43272,4051754821,2022-08-04
43.453448,5.418026,3881813858,8/1/2022 10:55:53 PM
43.776745,4.835513,4055011469,8/2/2022 12:36:52 PM
44.033722,5.004758,4054768467,8/2/2022 5:59:06 PM
46.293757,6.077992,3888884882,8/4/2022 11:09:47 AM
43.702544,7.310167,3902176882,8/5/2022 2:21:21 PM
43.789943,4.251082,3888833058,8/5/2022 4:05:11 PM
43.719718,7.275907,3902315973,8/6/2022 3:11:18 PM
43.262372,5.396598,3892556592,8/10/2022 12:43:59 PM
44.785589,4.692292,4054841476,2022-08-12T13:58
43.140943,3.131243,3902750272,2022-08-10T15:41
43.927401,4.298602,3902978789,8/12/2022 11:52:10 AM
43.124865,3.097284,3902715655,2022-08-10T17:31
44.591242,4.267464,3986144398,8/16/2022 4:01:42 PM
43.738253,4.823089,4009763939,2022-08-13
43.582479,5.015839,4022362675,2022-08-01
43.075267,5.92903,4116588632,2022-08-01T15:12
42.30031,9.54455,4051512861,2022-08-06
44.9381,0.87208,4151468633,2022-08-10
42.71144,9.4343,4051242133,2022-08-14
42.10001,9.27563,4050956006,2022-08-06
42.08719,9.49845,4050987829,2022-08-06
42.09292,9.32454,4051977899,2022-08-06
42.40679,9.53096,4051093795,2022-08-06
42.50578,9.47311,4051093979,2022-08-06
42.66142,9.43272,4051113058,2022-08-10
43.36969,2.28825,4548458899,2022-08-02
42.60006,9.43853,4051161022,2022-08-06
42.46864,9.48864,4051481721,2022-08-06
44.43852,2.62348,4569275622,2022-08-01
43.44043,2.04626,4568530792,2022-08-25
43.43383,6.83874,4547184725,2022-08-04
44.34123,1.5214,4569389607,2022-08-08
42.47969,9.48093,4051097878,2022-08-06
43.17677,6.59616,4086882238,2022-08-11
48.78978,2.48342,4593020681,2022-08-01
42.09103,9.3895,4051513579,2022-08-06
42.24496,9.54582,4051189677,2022-08-06
42.42375,9.52823,4050901117,2022-08-06
44.90288,0.89894,4151468466,2022-08-11
43.98157,5.08794,4087013569,2022-08-03
42.0698,9.18421,4051630963,2022-08-06
43.53277,2.30257,4569275956,2022-08-09
42.61511,9.43744,4051927292,2022-08-06
42.10092,9.24388,4051037460,2022-08-06
42.64244,9.43927,4051047926,2022-08-06
42.32881,9.53758,4051720612,2022-08-06
44.94491,0.88671,4151468425,2022-08-10
42.09668,9.30587,4051078228,2022-08-06
43.52108,3.77191,4542258860,2022-08-03
42.34705,9.53317,4051777359,2022-08-06
42.43854,9.51692,4051743299,2022-08-06
42.38028,9.53014,4052001036,2022-08-06
42.10466,9.51533,4051157204,2022-08-06
42.09813,9.22354,4051176449,2022-08-06
42.99431,-0.41862,4149542878,2022-08-09
44.90678,0.90668,4151468349,2022-08-11
42.45635,9.50179,4052035571,2022-08-06
42.08477,9.19691,4051895774,2022-08-06
42.71138,9.4542,4051625461,2022-08-10
42.087,9.36745,4052052954,2022-08-06
42.96366,1.63011,4569275582,2022-08-10
42.36588,9.52941,4050751831,2022-08-06
42.28465,9.55066,4050751977,2022-08-06
44.36805,1.482,4588367504,2022-08-24
42.23057,9.5445,4051495620,2022-08-06
42.15813,9.51757,4050829851,2022-08-06
42.58014,9.43989,4051171774,2022-08-06
42.71139,9.43544,4050842849,2022-08-07
43.91322,4.88619,4149354113,2022-08-03
43.17808,0.3976,4046935713,2022-08-03
43.1462,2.79828,4049077334,2022-08-04
43.74473,5.2283,4149353644,2022-08-06
42.96532,1.61024,4047041013,2022-08-10
42.71276,9.45386,4050852611,2022-08-06
42.67814,9.44571,4050885601,2022-08-06
42.06193,9.19336,4051849901,2022-08-06
44.95588,4.87166,4149181550,2022-08-28
44.95588,4.87166,4149128273,2022-08-28
44.95582,4.87168,4149215309,2022-08-27
44.67608,4.91344,4149169446,2022-08-17
44.67608,4.91344,4149147743,2022-08-17
44.85803,4.94809,4149073286,2022-08-07
44.85826,4.94874,4149174562,2022-08-05
45.66875,4.84596,4149178350,2022-08-04
44.9041,4.92462,4149184853,2022-08-04
44.96732,4.88771,4149072990,2022-08-04
44.85693,4.94758,4149193765,2022-08-04
42.71269,9.45401,4050914811,2022-08-04
44.93639,0.89379,4151468320,2022-08-11
42.49499,9.47051,4051293146,2022-08-06
42.12569,9.51039,4051010499,2022-08-06
43.388293,5.06672,3903394910,9/5/2022 11:44:49 AM
43.192638,5.591188,4121165462,9/5/2022 11:51:30 AM
43.391732,5.061064,3903396964,9/9/2022 5:16:16 PM
43.65887,-1.41708,4151582429,2022-09-22
42.996948,6.190217,4400162447,2022-10-12T11:19
42.998922,6.201008,4145602485,2022-10-14T11:34
43.65412,3.53386,4568434723,2022-10-30
44.38213,4.23821,4047233592,2022-10-28
43.83037,3.62965,4568313093,2022-10-24
44.11029,4.74372,4150049434,2022-06-15/2022-08-16
43.54676,4.66183,4046907898,2022-08-31/2022-09-01
42.02059,9.47131,3491767683,2021-03-25
44.42361,5.48125,4084256763,2021-04-23
43.599159,3.870314,4522553493,5/23/2021 3:00:24 PM
45.03906,-1.14908,4571721520,2021-06-22
43.68655,4.0963,4588623475,2021-06-29
43.77599,7.44215,4087587329,2021-06-24
43.74933,3.75147,4587932245,2021-06-24
43.93969,-1.3253,4541883581,2021-06-30
43.64025,3.8156,4588686613,2021-06-22
43.7409,7.19083,4086837283,2021-06-23
43.15388,5.85699,4084228926,2021-06-28
43.6367,3.81608,4588734609,2021-06-22
43.80511,4.94932,4049139386,2021-06-29
44.399858,4.373343,3904017811,2021-06-28
43.53455,1.43831,3940676552,2021-06-15
43.52123,5.56598,4084199256,2021-06-25
43.71214,4.08309,4588571565,2021-06-29
43.21387,2.86503,3939972267,2021-06-18
43.15707,5.73421,4084067630,2021-06-23
43.16731,2.38731,3853949628,2021-06-22
43.16504,3.02019,4047158727,2021-06-24
43.64084,4.05704,4588662853,2021-06-29
43.39859,6.72137,3831342844,2021-06-17
44.18796,5.90903,4084171199,2021-06-22
43.72035,3.94258,3939948595,2021-06-16
45.03288,-1.14437,4571653652,2021-06-22
43.56823,6.94351,3853219362,2021-06-25
43.16731,2.38731,3853949339,2021-06-22
43.68418,3.60197,4541802855,2021-06-23
45.03124,-1.14471,4571653644,2021-06-25
43.25055,2.76785,3939971649,2021-06-25
43.71258,3.98721,4588694108,2021-06-30
43.92062,7.20404,4086959771,2021-06-14
43.7245,4.05806,4588489325,2021-06-30
43.19718,5.92065,4084141871,2021-06-29
43.73101,3.72576,4587956400,2021-06-24
43.73849,7.2528,4087002570,2021-06-15
43.61081,7.05732,4086826648,2021-06-22
43.439381,3.207672,3947498432,6/21/2021 2:02:52 PM
43.645025,3.741501,3330782480,6/16/2021 10:24:35 AM
43.791096,4.406661,3321204634,6/25/2021 9:49:11 AM
43.791153,4.406722,3320853613,6/25/2021 9:50:13 AM
43.636704,3.816026,3330429508,6/22/2021 10:35:49 AM
43.83529,3.768172,3320848187,6/27/2021 2:06:51 PM
43.44043,5.462287,3321057248,6/29/2021 9:51:12 AM
43.533058,4.880536,3327728933,2021-06-27T08:54
42.931632,2.910594,3327682984,2021-06-30T09:48
43.73061,3.4265,3939448889,2021-06-15
43.68802,4.07393,4588623753,2021-06-29
43.40608,6.7236,3831431364,2021-06-24
43.23039,2.95697,3853896438,2021-06-09
43.717683,5.169464,3456916765,2021-06-29T22:38
43.88097,5.58215,4087617099,2021-06-29
43.40462,6.70944,3831440535,2021-06-22
43.58015,4.88762,4087061075,2021-06-24
43.24377,5.86144,4084259393,2021-06-30
43.73591,3.98245,4588506978,2021-06-30
43.70808,4.01097,4588392855,2021-06-30
43.77599,7.44215,4087587387,2021-06-29
44.21399,4.65834,4083877878,2021-06-24
43.75164,5.32792,4084112865,2021-06-24
43.76402,7.45847,3854290374,2021-06-29
43.90345,5.56032,3843744586,2021-06-29
43.39755,3.39959,3939448917,2021-06-21
43.85053,5.03612,3488967874,2021-06-30
43.8517,5.11025,3488973886,2021-06-30
43.40936,6.71063,3831456869,2021-06-25
43.24782,3.13932,3939960338,2021-06-16
43.76402,7.45847,3854290511,2021-06-24
43.44218,6.73636,4086986409,2021-06-24
44.21303,4.7209,4084203853,2021-06-24
43.75295,5.26588,4084234068,2021-06-29
43.65341,7.12238,4086906337,2021-06-27
43.61081,7.05732,4086837382,2021-06-26
43.44218,6.73636,4086837446,2021-06-24
43.48593,3.28276,3939449047,2021-06-21
43.58015,4.88762,4086926647,2021-06-24
43.7706,3.8228,4588506604,2021-06-30
43.69839,4.09457,4588444533,2021-06-29
43.74933,3.75147,4587948154,2021-06-24
43.7245,4.05806,4588516148,2021-06-30
44.72243,4.59413,4544097374,2021-07-26
44.11194,6.90547,4086804607,2021-07-29
43.40608,6.7236,3831125851,2021-07-12
43.37086,3.35829,3853896676,2021-07-20
45.14042,-0.86236,4588739356,2021-07-15
43.48057,6.92441,4086811841,2021-07-07
43.7785,7.38016,4086887947,2021-07-13
43.61081,7.05732,4086969018,2021-07-22
43.767,6.44684,4084261372,2021-07-15
42.94779,2.25501,3939971502,2021-07-11
43.357364,5.471135,3455534662,2021-07-25T22:39
44.227489,4.36537,3456942671,2021-07-26T12:40
43.773528,4.833068,3466353311,2021-07-14T10:24
43.768614,5.448254,3468897852,2021-07-03T18:05
43.76863,5.449657,3468693890,2021-07-04T06:58
43.91283,3.47651,4588573887,2021-07-27
43.180251,5.591797,3858441984,2021-07-01T14:49
43.297778,3.501892,4430852868,7/31/2021 12:10:20 PM
43.29745,3.502983,4430892883,7/31/2021 12:16:41 PM
44.112667,1.144903,3873443928,7/27/2021 11:59:07 AM
43.543705,6.69102,3902176939,7/8/2021 8:24:54 AM
45.02971,-1.174796,3925117086,2021-07-07T15:58
44.1912,5.78401,4084217344,2021-07-17
44.193122,3.214596,3994454348,2021-07-26T16:56
43.56109,3.95232,4587454304,2021-07-07
43.113269,5.968282,4075974268,2021-07-31T18:31
43.69113,7.31137,4087000867,2021-07-19
44.2278,6.09897,4084243555,2021-07-27
43.5791,6.68333,4087000927,2021-07-06
43.83887,5.45586,4087616916,2021-07-18
43.15707,5.73421,4084257730,2021-07-28
43.377506,4.807154,4465500488,2021-07-15T15:04
43.84489,-1.35168,4151495923,2021-07-28
43.39901,6.71597,3831253570,2021-07-19
44.42798,1.00564,4569513524,2021-07-17
43.69357,7.24946,4086857379,2021-07-31
43.52232,3.19978,4587397630,2021-07-08
43.49421,3.72327,3853901947,2021-07-13
43.82343,7.3836,4086857425,2021-07-28
43.5255,6.92748,4086853383,2021-07-18
43.61081,7.05732,4087007348,2021-07-25
43.6131,6.99548,4086857599,2021-07-22
43.48923,6.67757,4086853558,2021-07-12
44.36583,5.78218,4047149334,2021-07-12
43.73849,7.2528,4086857779,2021-07-31
43.73849,7.2528,4087007596,2021-07-18
44.803976,0.715238,4408060415,2021-07-10
44.544653,4.18356,4408027522,2021-07-17
43.451401,6.198727,4408033445,2021-07-20
44.465367,4.413646,4408324442,2021-07-08
45.385868,-1.154366,3905117726,2021-07-21
45.389287,-1.15583,3903956774,2021-07-23
44.345358,4.971437,3905662558,2021-07-15
43.644399,6.748734,3903965667,2021-07-30
43.5255,6.92748,4086928979,2021-07-18
44.06399,1.667564,3905047915,2021-07-04
43.69357,7.24946,4087007971,2021-07-27
44.98342,-1.10764,4081529484,2021-07-29
43.27912,3.12537,3939340449,2021-07-07
44.36027,1.95843,4152362386,2021-07-19
43.227482,5.407071,4462159048,2021-07-04
43.69598,3.38723,4587397746,2021-07-07
43.69357,7.24946,4086875312,2021-07-14
44.36583,5.78218,4047149338,2021-07-12
43.48923,6.67757,4087085635,2021-07-12
43.91208,3.59113,4588508946,2021-07-27
43.73605,7.31476,4086950847,2021-07-28
43.57043,6.93056,4087023675,2021-07-25
43.42023,5.99373,4084209515,2021-07-06
43.90821,7.51479,4087023702,2021-07-31
44.84336,-0.57595,3831313276,2021-07-21
43.69357,7.24946,4086951120,2021-07-18
43.58118,6.62152,4086873997,2021-07-06
43.27747,2.16196,4587455023,2021-07-09
43.78583,7.19412,4087024074,2021-07-30
43.78342,7.25614,4086971337,2021-07-30
43.40608,6.7236,3831335424,2021-07-07
43.80014,-1.39732,4151486526,2021-07-28
43.81836,7.50769,4086900804,2021-07-31
43.69357,7.24946,4086971824,2021-07-09
43.75295,5.26588,4084211535,2021-07-23
43.83076,7.19742,4086895888,2021-07-30
43.15707,5.73421,4084211707,2021-07-28
43.61081,7.05732,4086901188,2021-07-25
43.5255,6.92748,4087043028,2021-07-18
43.48923,6.67757,4087101119,2021-07-12
43.44218,6.73636,4086992418,2021-07-12
43.27763,3.10873,3939340666,2021-07-07
43.38562,3.46399,3853890668,2021-07-14
43.69357,7.24946,4086917538,2021-07-10
43.69409,3.91015,4588734711,2021-07-01
44.69582,1.17774,4151417327,2021-07-23
43.5318,5.07159,4084216141,2021-07-02
43.69113,7.31137,4087112544,2021-07-19
43.27371,5.96708,4049574097,2021-07-27
44.80266,-0.605,4151393331,2021-07-02
43.98274,5.02564,4087616526,2021-07-17
45.03288,-1.14437,4571722177,2021-07-22
43.44218,6.73636,4086919802,2021-07-12
43.74405,0.81981,4588626520,2021-07-26
43.5255,6.92748,4086919981,2021-07-18
43.56588,7.05414,4086918161,2021-07-25
43.82091,7.44565,4086916258,2021-07-31
43.48923,6.67757,4086943324,2021-07-12
43.44218,6.73636,4086939460,2021-07-26
43.5791,6.68333,4086945617,2021-07-06
43.48923,6.67757,4086945648,2021-07-12
43.85027,7.24007,4048933376,2021-07-30
43.69357,7.24946,4086945703,2021-07-08
43.5791,6.68333,4087086587,2021-07-06
44.02534,5.15193,4087616520,2021-07-15
43.60084,-1.43447,4151481764,2021-07-29
43.59283,3.64981,3939531558,2021-07-19
43.7245,4.05863,4588561005,2021-07-27
43.69357,7.24946,4086967355,2021-07-12
43.40608,6.7236,3831350232,2021-07-07
43.69357,7.24946,4087089318,2021-07-17
43.69357,7.24946,4087025617,2021-07-28
43.81836,7.50769,4087132803,2021-07-31
44.20144,5.34636,4087616796,2021-07-29
44.11631,6.78069,4087089789,2021-07-29
43.5255,6.92748,4086801473,2021-07-18
44.37469,0.49533,4151474331,2021-07-22
43.48057,6.92441,4086805630,2021-07-07
43.51187,0.61225,4588546893,2021-07-29
43.61081,7.05732,4086813889,2021-07-25
43.27945,3.11419,3939340810,2021-07-07
43.5255,6.92748,4086882089,2021-07-18
43.49421,3.72327,3853887922,2021-07-13
43.5791,6.68333,4086961168,2021-07-06
44.0198,6.96159,4086882179,2021-07-29
43.09719,3.03106,3939488478,2021-07-22
43.60848,7.11915,4087058544,2021-07-04
44.32622,0.22457,4151476468,2021-07-22
43.82591,7.32155,4087058730,2021-07-28
43.55049,4.95061,4150277152,2021-07-09
43.69113,7.31137,4087004478,2021-07-19
44.81655,1.5625,4544577702,2021-07-23
44.06399,1.667564,3325804977,2021-07-04T14:53
44.802663,-0.605,3325688074,2021-07-02T10:17
43.655537,6.007693,3325720197,7/6/2021 10:11:22 AM
43.473733,3.344642,3325703241,7/6/2021 6:36:27 PM
43.60848,7.11915,4086859463,2021-07-04
43.460537,4.732329,3325904547,2021-07-08T14:07
43.315731,2.799689,3325952558,7/8/2021 12:47:54 PM
44.802336,-0.604876,3327745721,2021-07-02T10:16
43.072983,5.801182,3327858798,7/10/2021 12:34:51 PM
43.563968,5.022221,3330408598,7/10/2021 3:49:37 PM
43.571546,4.832044,3330642567,7/11/2021 1:00:46 PM
43.602005,3.858178,4400233364,7/11/2021 12:03:10 PM
43.727108,4.03251,3328080472,7/14/2021 11:45:20 AM
43.13637,5.737097,3328136408,2021-07-14T12:56
43.468781,3.215899,3328153592,7/13/2021 8:18:55 AM
43.873837,3.804438,3328084700,7/15/2021 10:34:27 AM
43.332939,5.151542,3330469662,7/16/2021 3:47:31 PM
43.873347,4.495116,3330786664,2021-07-11T11:09
43.919466,5.202176,3330470729,7/16/2021 8:15:23 PM
43.558655,7.032386,3330637777,7/17/2021 10:51:37 AM
44.06619,2.85105,3944404579,2021-07-19
43.298874,3.501657,3330515967,2021-07-18T09:15
43.82714,3.692136,3330781993,2021-07-18T09:34
44.419118,4.908425,3330775164,7/19/2021 4:39:42 PM
42.663337,2.964108,4522480497,7/21/2021 8:04:06 AM
43.69357,7.24946,4086859582,2021-07-19
44.632788,1.255691,4524974604,7/21/2021 4:56:14 PM
43.950018,4.529154,4055043384,7/21/2021 7:16:58 PM
41.508477,9.017866,3333143676,7/23/2021 1:53:28 PM
43.792817,5.753344,4400417424,7/24/2021 12:19:56 PM
43.625392,3.87168,3333090989,7/25/2021 6:15:52 PM
43.644887,3.936612,3333043060,7/26/2021 10:42:04 AM
43.726412,4.805857,4400131342,7/26/2021 6:11:10 PM
43.617807,6.973133,3333270254,7/27/2021 10:50:06 AM
43.695805,7.280007,3881459376,7/27/2021 6:41:40 PM
43.70523,6.93981,4087004769,2021-07-05
44.124702,4.683955,3333433426,7/28/2021 5:04:45 PM
44.633718,1.255289,4524940728,2021-07-29T17:20Z
43.64276,3.805242,4506401511,2021-07-31
44.71454,1.68304,4544533417,2021-07-23
43.559113,3.458828,4063027395,7/31/2021 8:07:55 PM
43.207133,5.517695,3335089992,7/15/2021 6:52:03 PM
43.722899,3.853503,3335358997,2021-07-29T15:57
43.722925,3.853502,3743332396,2021-07-29T15:57
43.722963,3.853535,3743351397,2021-07-29T15:58
43.72295,3.853556,4400096409,2021-07-29T15:59
43.48497,6.801,4084252979,2021-07-27
44.305338,4.553235,3335084162,2021-07-25T12:25
43.92062,7.20404,4086924961,2021-07-14
45.3577,-1.15733,4151474665,2021-07-13
44.187484,4.840039,3338118237,7/27/2021 1:00:23 PM
43.15388,5.85699,4084261324,2021-07-30
43.60848,7.11915,4087013973,2021-07-02
44.1177,5.03044,4084248342,2021-07-23
44.156883,4.108478,3337477287,7/25/2021 11:00:58 AM
44.192424,5.006335,3337613990,2021-07-24T19:15Z
43.072372,5.7889,3343824682,2021-07-21T18:32
43.6131,6.99548,4086848276,2021-07-22
43.90821,7.51479,4086866401,2021-07-31
43.40063,6.72819,3831706129,2021-07-07
43.82591,7.32155,4086946689,2021-07-28
45.16482,0.68732,4594489128,2021-07-07
43.39859,6.72137,3831398231,2021-07-12
43.7785,7.38016,4086868550,2021-07-13
43.62513,4.88911,4086946884,2021-07-15
43.374676,5.448613,3456844320,2021-07-01T22:23
43.341457,5.462945,3398886244,2021-07-03T22:26
43.341388,5.462851,3398874139,2021-07-03T22:27
43.340653,5.462741,3399288174,2021-07-03T22:44
43.78583,7.19412,4087088759,2021-07-30
43.60224,4.00986,4588436460,2021-07-01
44.43867,1.00499,4569513430,2021-07-17
43.56817,6.99235,4087089042,2021-07-24
43.55416,3.81959,4588540064,2021-07-07
43.83076,7.19742,4088300334,2021-07-06
43.83076,7.19742,4088300364,2021-07-06
43.53828,6.55691,4084125992,2021-07-05
43.50773,6.55103,4049259630,2021-07-05
44.09236,-0.57726,4585382852,2021-07-01
43.66029,6.93672,4084022807,2021-07-06
43.73605,7.31476,4087103683,2021-07-31
43.5791,6.68333,4086891744,2021-07-06
43.26734,2.34532,4594508323,2021-07-22
43.69597,7.18754,4087049806,2021-07-16
43.63215,6.43873,4084173341,2021-07-02
43.7785,7.38016,4086925334,2021-07-28
44.00563,7.33519,4086925358,2021-07-13
43.42519,5.80871,4084241697,2021-07-05
43.65437,3.78034,4588417555,2021-07-08
43.63309,3.78545,4588498783,2021-07-08
44.05798,2.86733,3944402922,2021-07-19
43.44218,6.73636,4086925507,2021-07-12
43.7785,7.38016,4086892216,2021-07-28
43.86835,7.38705,4086912393,2021-07-31
43.10216,6.1001,4088317028,2021-07-22
43.69357,7.24946,4087079695,2021-07-21
44.06652,2.82955,3944406914,2021-07-27
43.35463,3.35246,3939693489,2021-07-20
42.35938,8.73286,4051845948,2021-07-29
43.52123,5.56598,4084272671,2021-07-20
44.23126,5.97388,4083980080,2021-07-30
44.48933,0.96362,4573321507,2021-07-11
43.61536,6.93364,4087066275,2021-07-22
43.65341,7.12238,4086912828,2021-07-22
44.80234,-0.60488,4151385620,2021-07-02
45.0089,-1.19658,4151494900,2021-07-12
43.69597,7.18754,4087115073,2021-07-16
43.65687,1.86147,4544533455,2021-07-25
43.65341,7.12238,4087080149,2021-07-22
43.14029,2.42278,4541987343,2021-07-28
44.36446,6.04367,4084220420,2021-07-20
43.69357,7.24946,4087123640,2021-07-09
43.7785,7.38016,4087080668,2021-07-13
43.61081,7.05732,4086947998,2021-07-25
43.2576,3.00563,3853899051,2021-07-14
43.60848,7.11915,4086948196,2021-07-02
43.49545,6.57946,3492264858,2021-07-18
43.51477,6.65602,3492264321,2021-07-18
43.68763,7.30733,3492264554,2021-07-25
43.19883,5.85921,4084252318,2021-07-08
44.11414,6.84308,4086972307,2021-07-29
44.30282,1.43888,4541991906,2021-07-29
43.90821,7.51479,4087030430,2021-07-31
43.78865,5.12426,3843744197,2021-07-09
44.01924,5.16774,3843744144,2021-07-15
43.96142,5.02821,3843744379,2021-07-17
43.83472,5.48124,3843744234,2021-07-18
44.18534,5.33215,3843744988,2021-07-29
43.63567,3.84676,3491585440,2021-07-13
43.13876,5.79568,3491473525,2021-07-14
43.96347,4.80032,3491472557,2021-07-17
43.82915,5.15626,3491480688,2021-07-24
44.51646,1.08336,3491480696,2021-07-20
43.97166,6.75892,3491583542,2021-07-25
43.136,5.72792,3491478673,2021-07-15
43.96665,4.37495,3491575729,2021-07-26
45.08283,5.05732,3491473940,2021-07-22
43.865,-1.29111,3491576982,2021-07-28
45.01166,1.09059,3491566013,2021-07-21
43.65803,6.99861,4087081175,2021-07-26
43.69895,-1.33167,4151482226,2021-07-28
43.34296,3.41127,3939340595,2021-07-21
43.60848,7.11915,4087098661,2021-07-06
43.65803,6.99861,4086949417,2021-07-24
43.78098,7.31815,4087111454,2021-07-28
43.62667,4.13376,3943474678,2021-07-07
43.19718,5.92065,4084203824,2021-07-08
43.78098,7.31815,4086952338,2021-07-28
43.60848,7.11915,4087030770,2021-07-06
44.11631,6.78069,4087111691,2021-07-29
43.7785,7.38016,4087094668,2021-07-28
43.5791,6.68333,4086952785,2021-07-06
43.79759,-1.39617,4151475088,2021-07-28
43.72259,3.9133,4588677832,2021-07-01
43.10216,6.1001,4088316814,2021-07-22
44.17248,-0.49155,4585382628,2021-07-05
43.44218,6.73636,4087040608,2021-07-12
43.645,6.00547,4084236130,2021-07-06
43.82343,7.3836,4086977657,2021-07-28
43.5429,3.81052,3940113224,2021-07-28
43.65341,7.12238,4086807019,2021-07-22
43.44218,6.73636,4086977827,2021-07-12
43.7785,7.38016,4086886177,2021-07-13
43.82343,7.3836,4087041023,2021-07-28
43.69597,7.18754,4086987393,2021-07-23
43.48057,6.92441,4086987134,2021-07-07
44.46373,1.89221,4544577444,2021-07-05
43.82091,7.44565,4086832542,2021-07-31
43.73358,7.37671,4087006480,2021-07-15
43.44218,6.73636,4086906723,2021-07-12
44.98342,-1.10764,4081529317,2021-07-28
43.97259,7.02069,4086832818,2021-07-29
43.78098,7.31815,4086832838,2021-07-28
43.27875,3.11533,3939340680,2021-07-07
43.86584,7.44915,4087059865,2021-07-31
43.69113,7.31137,4086834797,2021-07-19
43.61081,7.05732,4086834845,2021-07-06
43.69357,7.24946,4087007030,2021-07-20
45.02971,-1.1748,4151459347,2021-07-07
44.18796,5.90903,4083992563,2021-07-11
43.44218,6.73636,4087060237,2021-07-12
41.59267,9.34012,4149161871,2021-07-30
41.67106,9.3003,4149072967,2021-07-28
41.65585,9.30076,4149204799,2021-07-28
41.67106,9.3003,4149169904,2021-07-28
41.55782,9.27603,4149087785,2021-07-28
41.66604,9.29926,4149127589,2021-07-28
41.58096,9.29539,4149161887,2021-07-28
41.58285,9.28753,4149190614,2021-07-26
41.58188,9.28375,4149205250,2021-07-26
41.67959,9.31708,4149207850,2021-07-26
41.58994,9.27379,4149178541,2021-07-26
41.58285,9.28753,4149127698,2021-07-26
41.58391,9.29006,4149215640,2021-07-26
41.65145,9.29596,4149215768,2021-07-24
41.65145,9.29596,4149072462,2021-07-24
41.59689,9.28054,4149197602,2021-07-24
41.60087,9.27926,4149119578,2021-07-24
41.60087,9.27926,4149205014,2021-07-24
41.60087,9.27926,4149158430,2021-07-24
41.82423,9.40173,4149119867,2021-07-23
41.98681,9.40106,4149198093,2021-07-23
41.917,9.38923,4149054503,2021-07-23
42.08726,9.49824,4149182254,2021-07-23
45.76161,4.92024,4149211657,2021-07-22
45.08999,5.16297,4149072599,2021-07-20
44.85922,4.95058,4149150908,2021-07-18
45.09089,5.17219,4149211377,2021-07-21
45.08494,5.17326,4149143908,2021-07-21
44.85837,4.949,4149127883,2021-07-17
45.08785,5.16744,4149181493,2021-07-21
45.08869,5.1619,4149054479,2021-07-21
44.84162,4.88386,4149103449,2021-07-16
44.85632,4.86989,4149136219,2021-07-16
44.85941,4.95094,4149127596,2021-07-16
44.85837,4.94902,4149190966,2021-07-04
43.44218,6.73636,4086835203,2021-07-12
44.50131,1.59743,4544555542,2021-07-05
43.52232,3.19978,4587455057,2021-07-08
43.61081,7.05732,4086856480,2021-07-06
43.624,3.82085,4588593427,2021-07-30
43.10216,6.1001,4088316504,2021-07-05
43.85027,7.24007,4048933397,2021-07-30
43.6131,6.99548,4087005955,2021-07-06
44.22954,6.03643,4084257844,2021-07-27
43.38336,5.68325,4084226831,2021-07-29
43.75295,5.26588,4084248606,2021-07-22
43.60848,7.11915,4086856949,2021-07-07
44.47008,1.87045,4544533981,2021-07-05
43.61081,7.05732,4086854955,2021-07-06
43.55204,7.00479,4151040309,2021-07-20
43.55204,7.00479,4151037335,2021-07-02
43.93169,3.63588,4588508765,2021-07-27
43.7785,7.38016,4087020484,2021-07-28
43.44218,6.73636,4087044317,2021-07-12
44.53287,1.86153,4544578158,2021-07-05
43.75423,5.20383,4087618016,2021-07-09
43.69357,7.24946,4086872534,2021-07-23
43.768433,5.449311,3498648632,2021-07-04T00:00
43.96794,7.14514,4086887507,2021-08-27
43.61536,6.93364,4086978610,2021-08-05
44.10741,7.03023,4086811021,2021-08-12
43.64129,0.66266,3944183645,2021-08-13
43.65574,7.0605,4086803117,2021-08-17
43.6131,6.99548,4086969179,2021-08-29
43.5791,6.68333,4086979218,2021-08-07
43.71236,7.23793,4565202384,2021-08-13
43.57293,3.81426,4588506863,2021-08-26
43.101261,3.065419,3415527240,2021-08-22T11:52
43.28192,6.10976,4083855740,2021-08-03
44.878992,4.865867,4500886955,2021-08-27T07:37
44.10125,5.77961,4086834239,2021-08-12
45.03017,-1.15793,4151423749,2021-08-02
43.61081,7.05732,4087016366,2021-08-31
43.61536,6.93364,4086857675,2021-08-05
43.93999,4.89953,4087617049,2021-08-23
43.201191,5.507141,3905713546,2021-08-03
43.773573,4.832268,3903911775,2021-08-08
44.465392,4.413934,3905689829,2021-08-09
43.214322,5.535,3905881837,2021-08-10
44.771645,5.282643,3905220583,2021-08-02
45.106212,-1.140394,3905539879,2021-08-03
44.044529,6.831443,3905852658,2021-08-03
43.769078,2.062011,3905723732,2021-08-24
43.769007,2.062064,3905945638,2021-08-24
43.65341,7.12238,4087070242,2021-08-09
44.1051,7.0926,4087085397,2021-08-12
43.75295,5.26588,4084213781,2021-08-12
44.06016,7.08937,4086951098,2021-08-07
43.5791,6.68333,4086881267,2021-08-07
43.61536,6.93364,4086895659,2021-08-05
44.79426,1.10506,4574809316,2021-08-09
42.71132,9.45414,4051143049,2021-08-08
42.96429,2.17494,4150680433,2021-08-10
43.65104,7.18426,4086921964,2021-08-04
43.6131,6.99548,4086922079,2021-08-29
42.48224,9.15654,4051213928,2021-08-25
43.6131,6.99548,4087008387,2021-08-08
43.62513,4.88911,4084155286,2021-08-03
43.78342,7.25614,4087086549,2021-08-04
43.75295,5.26588,4084190023,2021-08-12
43.69357,7.24946,4086939998,2021-08-28
45.15654,0.67827,4151488466,2021-08-02
43.40937,6.36366,4084246551,2021-08-11
43.65574,7.0605,4086805344,2021-08-17
43.69357,7.24946,4086881478,2021-08-14
42.60005,9.4385,4050725352,2021-08-08
43.82591,7.32155,4086882006,2021-08-01
43.78583,7.19412,4086806177,2021-08-04
44.03264,0.03648,4151488472,2021-08-19
42.47765,9.1586,4050834575,2021-08-25
43.58118,6.62152,4086995545,2021-08-07
43.5791,6.68333,4087003241,2021-08-07
43.39901,6.71597,3831690080,2021-08-09
43.62682,4.134944,3335581374,2021-08-03T19:09
43.57043,6.93056,4086859989,2021-08-05
43.700409,3.555986,3337482159,2021-08-06T12:18
43.55049,4.95061,4150287022,2021-08-03
45.21403,-1.133345,4522559513,2021-08-05T17:27
45.029575,-1.1745,3337440280,2021-08-02T14:27
45.03017,-1.157928,3337412183,2021-08-02T17:53
44.530647,4.128298,3743191410,2021-08-05T15:46
44.525863,4.118719,3337576488,2021-08-06T14:42
44.794262,1.105061,3337667114,8/9/2021 5:25:27 PM
43.236855,5.36474,3337753630,2021-08-09T18:00
43.314518,5.54402,3337771034,2021-08-11T10:24Z
43.281898,5.369533,4076271546,8/14/2021 3:43:39 PM
43.779317,4.830411,3337936040,2021-08-08T11:37
44.248414,4.890754,4067230511,8/21/2021 5:55:33 PM
43.42166,2.96519,4588554762,2021-08-27
44.524501,5.062281,3902038865,2021-08-24T15:48
43.726501,3.550642,3355090863,8/18/2021 5:32:29 PM
43.726501,3.550642,3343928701,8/18/2021 5:32:29 PM
44.06898,2.81446,3944405624,2021-08-18
43.38336,5.68325,4084233752,2021-08-27
43.763658,3.814451,3355303453,2021-08-21T13:59
43.946514,1.917625,3355252408,8/25/2021 4:37:49 PM
43.698402,3.929349,3384426697,2021-08-02T11:02
43.102008,3.066348,3399245356,2021-08-22T11:52
43.5791,6.68333,4087088678,2021-08-07
43.5791,6.68333,4086886887,2021-08-07
43.58118,6.62152,4086947132,2021-08-07
44.1051,7.0926,4087047732,2021-08-12
43.5318,5.07159,4084173379,2021-08-06
44.20882,4.97111,4087616413,2021-08-05
43.55336,6.06257,4084112367,2021-08-10
44.25267,5.03527,4087617463,2021-08-05
45.02957,-1.1745,4151423604,2021-08-02
43.40063,6.72819,3831700031,2021-08-09
43.6131,6.99548,4086908551,2021-08-29
43.95313,7.51835,4086912651,2021-08-03
44.34013,1.51193,4544533471,2021-08-02
43.61536,6.93364,4087081610,2021-08-05
44.1051,7.0926,4086930465,2021-08-12
42.73161,9.46056,4051319805,2021-08-22
44.24788,5.0602,3843743443,2021-08-05
44.23233,4.98041,3843743958,2021-08-05
43.00524,6.23381,3491584982,2021-08-08
43.01109,6.39074,3491478102,2021-08-17
44.25437,1.46976,3491585158,2021-08-22
43.37123,2.89457,4588429345,2021-08-24
43.61748,3.36177,4588634637,2021-08-26
43.63971,6.19118,4084120623,2021-08-05
43.82983,5.8286,4087111400,2021-08-11
43.93544,4.84111,3843744431,2021-08-23
43.69357,7.24946,4086885394,2021-08-11
44.21399,4.65834,4084092759,2021-08-31
44.31949,6.04125,4084266201,2021-08-13
44.06452,2.83596,3944404280,2021-08-17
43.75164,5.32792,4084145973,2021-08-10
43.78342,7.25614,4086812926,2021-08-04
44.1051,7.0926,4086813027,2021-08-12
43.41496,6.17871,4084141495,2021-08-23
43.69357,7.24946,4087005420,2021-08-08
44.95587,4.87158,4149221433,2021-08-29
44.85233,4.91026,4149221459,2021-08-28
44.85097,4.92943,4149143548,2021-08-28
44.85721,4.94729,4149211674,2021-08-28
44.85835,4.94899,4149190418,2021-08-27
45.70387,4.84381,4149120201,2021-08-27
45.75824,4.8928,4149151252,2021-08-21
45.65097,5.17907,4149174683,2021-08-15
44.858,4.94904,4149150895,2021-08-11
45.08547,5.15996,4149088016,2021-08-11
45.0907,5.17145,4149216291,2021-08-11
45.08598,5.17561,4149054851,2021-08-11
45.75537,4.89894,4149175002,2021-08-09
41.65296,9.29639,4149087810,2021-08-07
42.41609,9.52946,4149178329,2021-08-08
42.30296,9.54458,4149218396,2021-08-08
42.06974,9.4526,4149072408,2021-08-08
41.96101,9.3974,4149143436,2021-08-08
41.87275,9.39701,4149207420,2021-08-08
41.65013,9.29499,4149169620,2021-08-07
41.72607,9.29682,4149184586,2021-08-06
41.67255,9.30336,4149190549,2021-08-06
42.56797,9.46803,4149088287,2021-08-03
41.58384,9.28747,4149087833,2021-08-05
42.57409,9.47331,4149211468,2021-08-04
41.58337,9.29053,4149143335,2021-08-05
42.96931,9.41392,4149200635,2021-08-03
43.00276,9.38914,4149127903,2021-08-03
43.00338,9.40486,4149204602,2021-08-03
42.6292,9.46879,4149193932,2021-08-02
44.34727,1.56366,4544598569,2021-08-14
44.40687,0.74777,4151495180,2021-08-27
43.57043,6.93056,4086851806,2021-08-05
43.65803,6.99861,4086851820,2021-08-13
44.04039,7.58777,4086926946,2021-08-03
43.60848,7.11915,4087020372,2021-08-31
43.15707,5.73421,4084101300,2021-09-01
43.854074,3.563756,3455886817,9/26/2021 3:13:45 PM
43.5791,6.68333,4087039340,2021-09-05
44.24684,1.67946,4544577888,2021-09-06
43.6131,6.99548,4087024488,2021-09-04
43.544599,7.133145,3355143678,9/1/2021 4:29:51 PM
46.126976,5.054968,4126774876,9/3/2021 7:20:54 PM
49.44138,1.072133,4076288548,9/3/2021 6:55:44 PM
43.517368,7.069415,4054771386,9/5/2021 2:27:52 PM
44.161441,5.017471,4145580331,9/9/2021 3:00:52 PM
43.88041,7.07649,4084235581,2021-09-09
43.2417,3.14996,3939971497,2021-09-30
45.08126,5.16114,4149150479,2021-09-14
44.85718,4.9472,4149103359,2021-09-04
44.95579,4.87155,4149178354,2021-09-05
44.95569,4.87147,4149162238,2021-09-04
45.08019,5.17297,4149193791,2021-09-01
45.08067,5.16456,4149054343,2021-09-01
45.08988,5.1728,4149191265,2021-09-01
45.08927,5.1692,4149151274,2021-09-01
43.64482,5.04469,4049853365,2021-04-26/2021-07-26
43.0087,6.21774,4087239002,2020-05-31
43.29497,5.61752,4087346842,2020-05-31
43.01051,6.15652,4087238986,2020-05-30
44.5473,0.94889,3492619324,2020-06-30
44.42484,0.74206,3486019505,2020-06-24
43.69834,7.12562,4086802848,2020-06-27
43.30065,5.37132,4085611285,2020-06-27/2020-06-29
44.58728,1.03849,3492619304,2020-06-30
44.25381,4.97268,4087617814,2020-06-18
43.62721,4.76527,4084057201,2020-06-25
43.32862,6.05062,4083852597,2020-06-23
44.20768,5.03366,4087617931,2020-06-20
43.572063,3.813019,4408228369,2020-06-18
44.01287,7.14841,4086836113,2020-06-29
43.70028,-1.33108,4151494627,2020-06-29
43.0087,6.21774,4087239188,2020-06-14
43.49021,4.88467,4084265649,2020-06-19
43.69113,7.31137,4086857783,2020-06-22
43.88384,5.45779,4087616638,2020-06-17
43.64864,7.24613,4086858017,2020-06-30
43.67413,4.64272,4084259967,2020-06-28
43.36633,6.29944,4083883700,2020-06-19
44.27798,1.58013,4544555771,2020-06-22
43.35073,5.12674,4085616369,2020-06-13/2020-06-15
43.56069,0.63957,4545408573,2020-06-19
44.51999,0.75785,3486019381,2020-06-25
43.9302,5.3975,4087616479,2020-06-22
43.73319,6.07219,4083898362,2020-06-24
43.26402,2.35261,4594502874,2020-06-15
43.31306,3.39914,4148507711,2020-06-22
43.96794,7.14514,4087053507,2020-06-29
43.03116,1.90653,4587397519,2020-06-25
43.43817,5.25348,4085523871,2020-06-26/2020-06-28
44.27324,1.58196,4544598334,2020-06-22
43.54049,1.4588,4550311303,2020-06-06
43.0087,6.21774,4087238806,2020-06-14
43.79827,-1.39099,4151474696,2020-06-30
44.29087,1.60833,4544555872,2020-06-25
43.01051,6.15652,4087238569,2020-06-14
43.69597,7.18754,4086992585,2020-06-30
43.39057,5.37503,4084036991,2020-06-29
43.568828,4.074229,4075617391,2020-06-16
43.838978,4.954737,4067251409,6/21/2020 4:09:17 PM
43.991102,5.146031,4400283315,2020-06-21T08:15
43.607133,3.512533,2802961400,2020-06-25T10:05
43.959231,4.863831,2814113934,2020-06-28T15:11
43.957442,4.708197,2814299610,6/29/2020 8:50:44 PM
43.927373,4.298748,2814308026,6/23/2020 11:09:33 AM
43.861995,3.905999,4054858342,6/30/2020 1:57:52 PM
43.472611,3.223141,2814311048,6/30/2020 12:37:54 PM
43.363444,5.542264,2814250978,2020-06-25T09:31
43.638926,3.864907,2814121229,2020-06-28T11:00
44.20026,4.62299,4566257375,2020-06-23
43.758398,4.94654,4522492355,2020-06-29T13:29
44.25267,5.03527,4087618080,2020-06-20
43.92765,7.01752,4087008999,2020-06-29
42.62377,2.23971,3942342213,2020-06-28
44.51999,0.75785,3486019917,2020-06-24
43.60174,5.94125,4084018578,2020-06-23
43.61081,7.05732,4086961157,2020-06-25
43.30065,5.37132,4085452608,2020-06-28/2020-06-30
44.28716,1.60433,4544555873,2020-06-25
43.857154,3.861127,3113410346,6/30/2020 2:34:19 PM
44.02151,5.33895,4087616870,2020-06-24
43.62721,4.76527,4083993063,2020-06-30
43.57043,6.93056,4086974285,2020-06-27
44.60935,0.96066,3492619301,2020-06-30
43.58015,4.88762,4083877897,2020-06-19
43.75667,5.07973,4084273175,2020-06-17
43.62744,0.28862,4588491643,2020-06-21
44.25381,4.97268,4087617980,2020-06-18
44.60935,0.96066,3492619358,2020-06-30
44.01522,7.08614,4087004469,2020-06-29
44.05115,2.81075,4587430947,2020-06-22
43.79819,-1.39046,4151495602,2020-06-30
43.53624,4.82433,4084238224,2020-06-26
43.66788,5.01451,4084189525,2020-06-29
43.42357,5.87038,4083888595,2020-06-23
43.97518,5.39939,4087617654,2020-06-27
44.1603,5.15704,4083943736,2020-06-25
43.66392,1.39752,4588597525,2020-06-30
44.08204,0.97912,4541817832,2020-06-19
43.67413,4.64272,4084177888,2020-06-27
43.80164,5.08137,4084112558,2020-06-30
44.02899,2.87501,4541808965,2020-06-29
44.20882,4.97111,4087618053,2020-06-20
43.71549,4.13922,4588506566,2020-06-15
43.54994,5.2888,3843743734,2020-06-06
43.33893,5.15463,3489930217,2020-06-14
43.34853,5.14501,3489934535,2020-06-14
43.34013,5.14816,3489950343,2020-06-14
42.65385,9.29611,3492336742,2020-06-18
42.70478,9.34135,3492334707,2020-06-19
42.70423,9.34087,3492336400,2020-06-19
42.67858,9.2802,3492328739,2020-06-19
42.68824,9.27375,3492328398,2020-06-19
42.65986,9.24289,3492330475,2020-06-19
43.69834,7.12562,4086889770,2020-06-27
42.71709,9.2045,3492335282,2020-06-20
42.72208,9.20091,3492334503,2020-06-20
43.88858,5.47985,3843743906,2020-06-17
44.26254,4.95613,3843744109,2020-06-18
44.23018,4.93326,3843744175,2020-06-18
44.23018,4.93326,3843744090,2020-06-18
44.21646,5.02872,3843743325,2020-06-20
44.24788,5.0602,3843743461,2020-06-20
44.19463,5.00107,3843744904,2020-06-20
42.70625,9.19276,3492334578,2020-06-20
42.72294,9.19981,3492330717,2020-06-20
42.72393,9.19863,3492331089,2020-06-20
42.72462,9.19808,3492334698,2020-06-20
42.7244,9.20038,3492328280,2020-06-20
42.72436,9.20167,3492333127,2020-06-20
42.72444,9.20016,3492333076,2020-06-20
42.72414,9.19944,3492334600,2020-06-20
42.71099,9.20519,3492335269,2020-06-20
42.71812,9.22085,3492324788,2020-06-16
42.71778,9.22317,3492334657,2020-06-16
42.70423,9.34118,3492327629,2020-06-19
42.68838,9.2739,3492333221,2020-06-19
42.7248,9.2012,3492332411,2020-06-20
42.72266,9.19948,3492336600,2020-06-20
42.72478,9.20336,3492330531,2020-06-20
42.72141,9.20207,3492328709,2020-06-20
42.66276,9.23058,3492334188,2020-06-21
42.6627,9.31488,3492322508,2020-06-21
42.72896,9.34663,3492327369,2020-06-21
42.70789,9.34185,3492334357,2020-06-21
42.65882,9.23397,3492334307,2020-06-21
42.6471,9.10095,3492324501,2020-06-22
42.45877,9.08913,3492325165,2020-06-22
42.64712,9.09224,3492334670,2020-06-22
42.65989,9.23472,3492330380,2020-06-23
42.69061,9.31924,3492328614,2020-06-23
42.69881,9.36665,3492335139,2020-06-23
42.6974,9.35086,3492327998,2020-06-23
42.66508,9.30906,3492327373,2020-06-23
42.65981,9.23197,3492336566,2020-06-23
42.72904,9.34601,3492325875,2020-06-21
42.71596,9.20564,3492327517,2020-06-20
42.66453,9.21477,3492322425,2020-06-24
42.66344,9.20305,3492334915,2020-06-24
42.70752,9.19432,3492335161,2020-06-24
42.71249,9.20665,3492322439,2020-06-24
42.71488,9.21125,3492330624,2020-06-24
42.71507,9.21209,3492336322,2020-06-24
42.71804,9.22076,3492326097,2020-06-24
42.71772,9.22292,3492325674,2020-06-24
42.7176,9.22372,3492324622,2020-06-24
42.71811,9.22616,3492324377,2020-06-24
42.7187,9.22827,3492336903,2020-06-24
42.72021,9.23144,3492322532,2020-06-24
42.71993,9.23185,3492325249,2020-06-24
42.71961,9.23146,3492326136,2020-06-24
42.71904,9.23325,3492324334,2020-06-24
42.71967,9.23312,3492324635,2020-06-24
42.71313,9.20797,3492333038,2020-06-24
42.68817,9.16959,3492333425,2020-06-24
42.68794,9.17017,3492332372,2020-06-24
42.68723,9.16919,3492333581,2020-06-24
42.68676,9.16851,3492330466,2020-06-24
42.68534,9.16728,3492325587,2020-06-24
42.65116,9.2934,3492327400,2020-06-26
42.65411,9.29657,3492324713,2020-06-26
42.65428,9.29908,3492334509,2020-06-26
42.65112,9.44089,3492324652,2020-06-27
42.64131,9.4488,3492332474,2020-06-27
42.64186,9.44761,3492333124,2020-06-27
42.6398,9.45894,3492333612,2020-06-27
42.64215,9.44837,3492334130,2020-06-27
42.64072,9.45992,3492327941,2020-06-27
42.53942,9.49434,3492325785,2020-06-27
43.95908,5.37322,3843744650,2020-06-22
44.01291,5.25317,3843743894,2020-06-24
43.95908,5.37322,3843744999,2020-06-27
42.54299,9.51677,3492327488,2020-06-27
43.44279,5.22437,3489937488,2020-06-27
43.31837,5.38948,3489949276,2020-06-28
43.31638,5.39115,3489930628,2020-06-29
43.31633,5.39074,3489950732,2020-06-30
43.5268,5.31881,4087617752,2020-06-06
43.82695,5.31474,3843744523,2020-06-30
43.82695,5.31474,3843743774,2020-06-30
43.79123,3.41829,4588455689,2020-06-23
44.33829,1.09635,4541994995,2020-06-23
44.05137,2.89401,3944407933,2020-06-29
43.35073,5.12674,4085639010,2020-06-13/2020-06-15
43.29361,5.56323,4152417437,2020-06-24
43.5392,4.63886,4087265195,2020-06-20
44.27822,1.58721,4544577953,2020-06-25
43.57043,6.93056,4087123857,2020-06-27
43.65341,7.12238,4087123870,2020-06-30
43.10391,6.03877,4087373204,2020-06-24
42.94765,2.25522,3939948889,2020-06-21
43.02147,3.03822,3491512896,2020-06-20
43.61722,1.63702,3491405090,2020-06-30
43.85053,5.03612,3488969860,2020-06-25
43.8517,5.11025,3488970163,2020-06-25
43.28013,6.17128,4083953196,2020-06-24
44.0551,2.90847,4541824693,2020-06-29
43.29788,5.49443,4087372890,2020-06-22
43.79793,5.26766,4087617574,2020-06-30
44.04733,2.88791,4541824931,2020-06-30
44.01287,7.14841,4086813156,2020-06-29
43.0087,6.21774,4087239105,2020-06-14
43.53824,4.70068,4087348012,2020-06-15/2020-06-17
44.55808,1.34112,4587407810,2020-06-24
43.32325,6.23531,4084043527,2020-06-24
43.35073,5.12674,4085608288,2020-06-13/2020-06-15
44.1603,5.15704,4083861792,2020-06-25
43.32686,6.11219,4084004092,2020-06-22
43.10216,6.1001,4087239048,2020-06-14
43.63846,3.5582,3939971936,2020-06-02
43.65341,7.12238,4086927121,2020-06-30
43.73319,6.07219,4083945804,2020-06-24
43.79793,5.26766,4087616445,2020-06-30
43.57043,6.93056,4087033374,2020-07-09
44.01287,7.14841,4086802368,2020-07-31
43.5039,0.39663,4588649878,2020-07-25
43.97653,5.3371,4087617733,2020-07-14
43.66029,6.93672,4087033452,2020-07-09
43.923,7.14187,4085444553,2020-07-27/2020-07-29
43.78583,7.19412,4086810508,2020-07-12
43.30065,5.37132,4085445623,2020-07-27/2020-07-29
43.28525,3.17405,3942324135,2020-07-15
44.30361,0.21197,3470578203,2020-07-05
44.06375,5.46556,4087616897,2020-07-16
43.26133,3.23999,3942335118,2020-07-16
43.77344,7.50415,4086810840,2020-07-17
43.96794,7.14514,4085441161,2020-07-27/2020-07-29
41.55247,9.21422,3992667793,2020-07-15
43.77344,7.50415,4086978901,2020-07-17
43.36443,6.36103,4087874396,2020-07-30
43.32189,3.04806,4587297487,2020-07-09
43.20006,2.14837,4587281236,2020-07-23
43.27729,3.10978,3942323900,2020-07-16
43.12352,1.6156,4587407342,2020-07-23
43.69834,7.12562,4086805035,2020-07-13
43.69357,7.24946,4086812080,2020-07-19
44.3924,0.99591,3470884325,2020-07-10
43.1788,6.53477,4083971102,2020-07-24
44.30496,1.43858,3944185209,2020-07-29
44.17007,0.82043,4573004355,2020-07-07
44.21399,4.65834,4083843345,2020-07-02
43.30065,5.37132,4085451686,2020-07-08/2020-07-10
43.69357,7.24946,4086907305,2020-07-13
43.57043,6.93056,4086836374,2020-07-23
43.31546,3.14404,4587289656,2020-07-08
44.11994,4.90554,4087616596,2020-07-25
43.81836,7.50769,4086836470,2020-07-17
43.92062,7.20404,4086835450,2020-07-16
42.995799,2.81373,3858278978,2020-07-23T18:32
43.24982,2.79701,4587306896,2020-07-09
43.61081,7.05732,4087055715,2020-07-23
44.528375,4.293008,3924990932,2020-07-14T18:23
44.06375,5.46556,4087617973,2020-07-16
43.61081,7.05732,4087000739,2020-07-25
44.35566,1.49241,4541995012,2020-07-20
42.876782,2.860676,4006559146,2020-07-12T16:04
43.864516,4.838554,4022025978,2020-07-13T13:30
44.11147,5.34265,4087617426,2020-07-26
43.66029,6.93672,4086836859,2020-07-29
43.56654,7.12438,4148516562,2020-07-10
43.27066,3.11793,3942360381,2020-07-16
43.57043,6.93056,4086989851,2020-07-23
43.61081,7.05732,4086907942,2020-07-06
43.923,7.14187,4085635678,2020-07-27/2020-07-29
43.32189,3.04806,4587270878,2020-07-08
44.37625,1.03983,3470653305,2020-07-10
43.30065,5.37132,4085539744,2020-07-13/2020-07-15
44.33963,1.09632,3944184224,2020-07-28
43.38336,5.68325,4085474912,2020-07-11/2020-07-13
43.7497,1.76536,4588485153,2020-07-23
44.697997,5.19759,4507866572,2020-07-11T19:29
43.090854,2.57802,4408176387,2020-07-06
44.11,3.85,4408166378,2020-07-11
44.016109,4.468831,4408316357,2020-07-05
43.431652,5.057015,4408178422,2020-07-21
43.61081,7.05732,4086832077,2020-07-23
43.395202,6.446899,4408289390,2020-07-27
43.178517,0.397847,4408184347,2020-07-27
43.394928,6.446712,4408337414,2020-07-31
44.198741,5.942346,4408046335,2020-07-15
44.231163,1.528863,4408267389,2020-07-24
43.57043,6.93056,4086834201,2020-07-29
43.60848,7.11915,4086834213,2020-07-22
43.24982,2.79701,4587262026,2020-07-11
43.61081,7.05732,4087056280,2020-07-23
44.09965,5.84202,4083930511,2020-07-12
43.93215,6.89315,4087016311,2020-07-16
44.22954,6.03643,4083873500,2020-07-07
43.2808,3.19157,3942312918,2020-07-15
44.20405,3.21892,4542087071,2020-07-29
44.21548,1.68047,4544556147,2020-07-07
43.57043,6.93056,4087007520,2020-07-25
44.340096,5.07808,4408040499,2020-07-14
44.05781,7.15169,4085593710,2020-07-24/2020-07-26
43.24574,2.77095,4587306728,2020-07-11
43.57043,6.93056,4087069821,2020-07-15
43.69357,7.24946,4087016837,2020-07-07
43.81303,3.59952,4587937922,2020-07-20
43.92534,7.0797,4087007780,2020-07-16
44.19532,3.18618,3944397629,2020-07-28
43.99806,7.52192,4086929027,2020-07-26
43.23302,2.2302,4587289737,2020-07-23
43.30159,3.34798,4587289946,2020-07-08
45.3397,-1.09989,3495022396,2020-07-14
44.05814,2.90146,4541793870,2020-07-23
44.42289,0.58628,4084860444,2020-07-20
